date,category,title,article_count,clean_title,keywords
2025-01-03,total,"8시께 진입했는데…공수처, 인간벽 친 경호처와 대치 중",691,8시께 진입했는데 공수처 인간벽 친 경호처와 대치 중,"['진입', '공수', '인간', '대치']"
2025-01-03,total,"공수처, 尹체포영장 제시…경호처장 ""수색 불허""",137,공수처 체포영장 제시 경호처장 수색 불허,"['공수', '체포영장', '제시', '처장', '수색', '불허']"
2025-01-03,total,경찰 '제주항공 참사 악성 게시글' 70건 내사,72,경찰 제주항공 참사 악성 게시글 70건 내사,"['제주항공', '악성', '게시']"
2025-01-03,total,F4 복귀한 최상목…“매주 회의 주재해 시장점검”,69,F4 복귀한 최상목 매주 회의 주재해 시장점검,"['F4', '복귀']"
2025-01-03,total,"권성동 ""무리한 대통령 체포 시도 자제해야""",63,권성동 무리한 대통령 체포 시도 자제해야,"['권성동', '무리', '대통령', '시도', '자제']"
2025-01-03,total,"외신, 공수처 尹 대통령 체포영장 집행 시도 집중 보도",58,외신 공수처 대통령 체포영장 집행 시도 집중 보도,"['외신', '공수', '대통령', '체포영장', '시도', '집중']"
2025-01-03,total,"검찰, '계엄 중요임무' 박안수·곽종근 구속 기소",52,검찰 계엄 중요임무 박안수 곽종근 구속 기소,"['계엄', '임무']"
2025-01-03,total,"SPC그룹, 파리바게뜨 글로벌 사업 조직 개편",45,SPC그룹 파리바게뜨 글로벌 사업 조직 개편,"['SPC그룹', '파리바게뜨', '조직', 'SPC']"
2025-01-03,total,1월 14일 탄핵심판 본격 시작…尹 출석 의무 있어,42,1월 14일 탄핵심판 본격 시작 출석 의무 있어,"['1월 14일', '탄핵', '심판', '의무']"
2025-01-03,total,"안보실, 부승찬 등 민주당 의원 13명 명훼 고발",33,안보실 부승찬 등 민주당 의원 13명 명훼 고발,"['안보', '승차', '민주당']"
2025-01-02,total,이정애 LG생활건강 사장 “글로벌 사업 재구조화 집중”,174,이정애 LG생활건강 사장 글로벌 사업 재구조화 집중,"['이정애', 'LG생활건강', '사장', '구조', '집중', 'LG']"
2025-01-02,total,"신동빈 회장 ""고강도 쇄신으로 핵심사업 경쟁력 회복""",151,신동빈 회장 고강도 쇄신으로 핵심사업 경쟁력 회복,"['신동빈', '강도', '경쟁력']"
2025-01-02,total,삼성전자 “지금까지 성공방식 초월한 혁신 필요”,129,삼성전자 지금까지 성공방식 초월한 혁신 필요,"['삼성전자', '방식', '초월']"
2025-01-02,total,"전남경찰, 무안공항·제주항공 등 압수수색",112,전남경찰 무안공항 제주항공 등 압수수색,"['전남', '무안', '제주항공']"
2025-01-02,total,"삼성전기·LG이노텍, 올해 성장 드라이브 건다",108,삼성전기 LG이노텍 올해 성장 드라이브 건다,"['삼성전기', 'LG이노텍', '드라이브', 'LG']"
2025-01-02,total,"경찰 ""공수처 尹 체포지원 위법성 없도록 협의""",103,경찰 공수처 체포지원 위법성 없도록 협의,"['공수', '위법성']"
2025-01-02,total,"우아한형제들, 우버 출신 김범석 신임 대표 선임",95,우아한형제들 우버 출신 김범석 신임 대표 선임,"['형제', '우버', '출신', '김범석', '신임', '선임']"
2025-01-02,total,"지지자에 편지 보낸 윤석열에…與 ""국민 간 충돌 우려""",80,지지자에 편지 보낸 윤석열에 국민 간 충돌 우려,"['지지자', '편지', '윤석열', '충돌']"
2025-01-02,total,최상목 엄호하는 이창용…경제 투톱 '비상 공조',80,최상목 엄호하는 이창용 경제 투톱 비상 공조,"['엄호', '이창용', '비상', '공조']"
2025-01-02,total,"최평규 SNT그룹 회장, 지속가능 경영 강조",65,최평규 SNT그룹 회장 지속가능 경영 강조,['SNT']
2025-01-01,total,"대통령실 수석 이상 참모진, 崔대행에 사의",146,대통령실 수석 이상 참모진 대행에 사의,"['대통령', '수석', '이상', '참모진', '대행']"
2025-01-01,total,"최상목 권한대행, 현충원 참배·중대본 개최·군부대 방문",94,최상목 권한대행 현충원 참배 중대본 개최 군부대 방문,"['대행', '충원', '중대', '군부대']"
2025-01-01,total,공수처장 “尹체포영장 원칙따라 집행… 막으면 공무방해”,86,공수처장 체포영장 원칙따라 집행 막으면 공무방해,"['공수', '처장', '체포영장', '공무', '방해']"
2025-01-01,total,"박찬대, 새해 첫날 현충원 찾아 ""내란극복·민생안정""",78,박찬대 새해 첫날 현충원 찾아 내란극복 민생안정,"['박찬', '첫날', '충원', '내란', '극복', '민생']"
2025-01-01,total,"최상목 권한대행 ""민생과 국정안정에 온 힘""",60,최상목 권한대행 민생과 국정안정에 온 힘,"['대행', '민생', '국정']"
2025-01-01,total,지난해 수출 역대 최대…6838억달러,57,지난해 수출 역대 최대 6838억달러,[]
2025-01-01,total,"정지선 현대백 회장 신년사 ""변화의 파고 함께 맞서자""",51,정지선 현대백 회장 신년사 변화의 파고 함께 맞서자,"['정지선', '현대', '신년사', '변화', '파고']"
2025-01-01,total,"김병환 위원장 ""금융 시장 안정 최우선…민생금융 강화""",30,김병환 위원장 금융 시장 안정 최우선 민생금융 강화,"['김병화', '금융 시장', '민생']"
2025-01-01,total,"김태규 방통위원장 대행, 사직서 제출",23,김태규 방통위원장 대행 사직서 제출,"['김태규', '방통', '대행', '사직서']"
2025-01-01,total,"서울시, 민생회복·소상공인 총력 지원에 2.1조 투입",23,서울시 민생회복 소상공인 총력 지원에 2 1조 투입,"['서울시', '민생', '소상', '공인', '총력', '투입']"
2025-01-10,total,"박종준 경호처장, 오전 10시 경찰 출석 예정",140,박종준 경호처장 오전 10시 경찰 출석 예정,"['박종준', '처장']"
2025-01-10,total,"최상목 ""금융 변동성 완화됐으나 높은 경계심""",70,최상목 금융 변동성 완화됐으나 높은 경계심,['경계심']
2025-01-10,total,'백골단' 국회 기자회견 논란…김민전 사과,65,백골단 국회 기자회견 논란 김민전 사과,"['기자회견', '김민전', '사과']"
2025-01-10,total,"경찰, 2차 체포작전 지휘관 총소집…작전계획 논의",44,경찰 2차 체포작전 지휘관 총소집 작전계획 논의,"['작전', '지휘관', '소집']"
2025-01-10,total,국민의힘 34%·민주 36%…계엄 이전으로 지지율 회복,34,국민의힘 34 민주 36 계엄 이전으로 지지율 회복,"['민주', '계엄']"
2025-01-10,total,노상원 전 정보사령관 구속기소…계엄 사전모의 혐의,34,노상원 전 정보사령관 구속기소 계엄 사전모의 혐의,"['상원', '정보', '사령관', '계엄', '전모']"
2025-01-10,total,"의료계와 협상 나서는 與…권성동 ""수련특례 요청""",33,의료계와 협상 나서는 권성동 수련특례 요청,"['의료', '권성동', '수련', '특례', '요청']"
2025-01-10,total,기업은행 240억 불법 대출 적발…금감원 현장검사 나서,25,기업은행 240억 불법 대출 적발 금감원 현장검사 나서,"['기업은행', '불법', '대출', '적발', '금감원', '검사']"
2025-01-10,total,"SKT, SK하이닉스·펭귄솔루션스와 AI DC 동맹",23,SKT SK하이닉스 펭귄솔루션스와 AI DC 동맹,"['SK하이닉스', '펭귄', '솔루션스', '동맹', 'SKT', 'SK', 'AI', 'DC']"
2025-01-10,total,이재명 해병 특검법 신속 추진 ,22,이재명 해병 특검법 신속 추진,"['이재명', '특검', '신속']"
2025-01-09,total,'항명 혐의' 박정훈 대령 1심 무죄,123,항명 혐의 박정훈 대령 1심 무죄,"['항명', '박정훈', '대령', '무죄']"
2025-01-09,total,"경찰, ‘尹 체포 방해’ 26명 경호처에 신원확인 요청",87,경찰 체포 방해 26명 경호처에 신원확인 요청,"['방해', '신원', '확인', '요청']"
2025-01-09,total,"당정, 설 성수품 평시 대비 1.6배 이상 확대 공급",82,당정 설 성수품 평시 대비 1 6배 이상 확대 공급,"['당정', '성수', '평시', '이상']"
2025-01-09,total,"‘여신도 성폭행’ JMS 정명석, 징역 17년형 확정",64,여신도 성폭행 JMS 정명석 징역 17년형 확정,"['여신', '성폭행', '정명석', '징역', 'JMS']"
2025-01-09,total,"민주, 내란 특검법 재발의…외환유치죄·제3자 추천 포함",64,민주 내란 특검법 재발의 외환유치죄 제3자 추천 포함,"['민주', '내란', '특검', '재발', '외환유치죄', '추천', '포함']"
2025-01-09,total,"SK하이닉스, 최태원·젠슨황 만남에 3% 상승세",56,SK하이닉스 최태원 젠슨황 만남에 3 상승세,"['SK하이닉스', '최태원', '만남', '상승세', 'SK']"
2025-01-09,total,"현대차그룹, 25년 역대 최대 규모 국내 투자",56,현대차그룹 25년 역대 최대 규모 국내 투자,['현대차']
2025-01-09,total,"미 반도체 수출, 중·러엔 아예 안한다",49,미 반도체 수출 중 러엔 아예 안한다,['반도체']
2025-01-09,total,제주항공 참사 희생자 모두 영면…사고 발생 11일 만,47,제주항공 참사 희생자 모두 영면 사고 발생 11일 만,"['제주항공', '희생자']"
2025-01-09,total,"헌법재판소 ""尹 탄핵 심판 속도, 이례적이지 않아""",46,헌법재판소 탄핵 심판 속도 이례적이지 않아,"['헌법재판소', '탄핵', '심판', '속도', '이례']"
2025-01-08,total,1월 27일 임시 공휴일 지정… 설 연휴 총 엿새 쉰다,97,1월 27일 임시 공휴일 지정 설 연휴 총 엿새 쉰다,"['1월 27일', '임시', '공휴일', '지정']"
2025-01-08,total,"국힘, 내란·김여사 특검법 '부결' 당론 유지 결정",95,국힘 내란 김여사 특검법 부결 당론 유지 결정,"['내란', '특검', '당론']"
2025-01-08,total,"野, 윤석열 대통령 도피설 제기…""제보 있다""",89,윤석열 대통령 도피설 제기 제보 있다,"['윤석열', '대통령', '도피', '제보']"
2025-01-08,total,삼성전자 4분기 실적 기대치 밑돌아,67,삼성전자 4분기 실적 기대치 밑돌아,['삼성전자']
2025-01-08,total,"이재명 ""법질서 안 지켜지면, 민생·경제는 모래성""",65,이재명 법질서 안 지켜지면 민생 경제는 모래성,"['이재명', '법질서', '민생', '모래성']"
2025-01-08,total,"정용진, 트럼프 취임식 참석…무도회까지 초대받아",50,정용진 트럼프 취임식 참석 무도회까지 초대받아,"['정용진', '트럼프', '취임식', '무도회', '초대']"
2025-01-08,total,'전당대회 돈봉투 의혹' 송영길 1심 징역 2년,44,전당대회 돈봉투 의혹 송영길 1심 징역 2년,"['전당', '대회', '봉투', '송영길', '징역']"
2025-01-08,total,경상수지 7개월 연속 흑자에도…흑자 폭 두달 연속 감소,39,경상수지 7개월 연속 흑자에도 흑자 폭 두달 연속 감소,"['경상수지', '두다']"
2025-01-08,total,"기상청 ""서울 전역에 오후 9시 한파주의보 발효""",32,기상청 서울 전역에 오후 9시 한파주의보 발효,"['기상청', '전역', '한파', '주의보', '발효']"
2025-01-08,total,별풍선 쏘려고…공금 5억 빼돌린 병원 직원 결국,30,별풍선 쏘려고 공금 5억 빼돌린 병원 직원 결국,"['풍선', '공금', '병원', '직원']"
2025-01-07,total,"박찬대 ""공수처, 영장 재발부시 尹 반드시 체포해야""",109,박찬대 공수처 영장 재발부시 반드시 체포해야,"['박찬', '공수', '재발', '부시']"
2025-01-07,total,"尹대통령측 ""형법상 내란죄 철회는 탄핵소추 각하 사유""",92,대통령측 형법상 내란죄 철회는 탄핵소추 각하 사유,"['대통령', '형법', '내란죄', '탄핵', '소추', '사유']"
2025-01-07,total,"민주, 최상목 권한대행..직무유기 혐의 고발",55,민주 최상목 권한대행 직무유기 혐의 고발,"['민주', '대행', '직무', '유기']"
2025-01-07,total,"경찰, ‘2차 소환 불응’ 경호처장에 3차 소환 통보",52,경찰 2차 소환 불응 경호처장에 3차 소환 통보,"['불응', '처장']"
2025-01-07,total,"오동운 공수처장 ""윤 대통령 체포 무산, 국민께 죄송""",47,오동운 공수처장 윤 대통령 체포 무산 국민께 죄송,"['동우', '공수', '처장', '대통령', '무산']"
2025-01-07,total,中 티베트에서 규모 6.8 강진…9명 사망,41,티베트에서 규모 6 8 강진 9명 사망,"['티베트', '강진', '사망']"
2025-01-07,total,"일본 투자, 375% 폭발! 한국에 쏟아진 외국인 자본",38,일본 투자 375 폭발 한국에 쏟아진 외국인 자본,"['일본', '폭발', '외국인', '자본']"
2025-01-07,total,건강보험 급여 보장률 전년 대비 0.8%p↓,35,건강보험 급여 보장률 전년 대비 0 8 p,"['건강보험', '급여', '보장']"
2025-01-07,total,"경찰, 제주항공 참사 유가족 비방 144건 수사 중",35,경찰 제주항공 참사 유가족 비방 144건 수사 중,"['제주항공', '유가족', '비방']"
2025-01-07,total,"KB국민은행, 중소기업·소상공인 대상 금융지원 시행  ",32,KB국민은행 중소기업 소상공인 대상 금융지원 시행,"['국민은행', '소상', '공인', 'KB']"
2025-01-06,total,"尹체포 난항…공수처, 체포영장 기한 연장 신청키로",405,체포 난항 공수처 체포영장 기한 연장 신청키로,"['난항', '공수', '체포영장', '기한']"
2025-01-06,total,"이재명 “최상목, 경호처 제지 않는 건 제2의 내란”",129,이재명 최상목 경호처 제지 않는 건 제2의 내란,"['이재명', '제지', '내란']"
2025-01-06,total,헌재 “탄핵사유 변경은 재판부 판단 사항”,89,헌재 탄핵사유 변경은 재판부 판단 사항,"['헌재', '탄핵', '사유', '변경', '재판부', '판단', '사항']"
2025-01-06,total,“尹 체포 안돼” 친윤계 의원 30여명 관저 집결,78,체포 안돼 친윤계 의원 30여명 관저 집결,"['윤계', '여명', '관저', '집결']"
2025-01-06,total,"北, 새해 첫 탄도미사일 발사…트럼프 취임 앞두고 도발",78,새해 첫 탄도미사일 발사 트럼프 취임 앞두고 도발,"['탄도', '미사일', '발사', '트럼프', '취임', '도발']"
2025-01-06,total,"‘제주항공 참사’ 국회 특별대책위, 이르면 이번주 출범",40,제주항공 참사 국회 특별대책위 이르면 이번주 출범,"['제주항공', '대책위', '출범']"
2025-01-06,total,"NH투자증권, '2025년 상품전략 세미나' 개최",36,NH투자증권 2025년 상품전략 세미나 개최,"['NH투자증권', '상품', '세미나', 'NH']"
2025-01-06,total,"서울시, '디딤씨앗통장' 대상 확대… 취약아동 지원",34,서울시 디딤씨앗통장 대상 확대 취약아동 지원,"['서울시', '씨앗', '통장', '아동']"
2025-01-06,total,"신한은행, 설 명절 중소기업에 15조 규모 금융 지원",33,신한은행 설 명절 중소기업에 15조 규모 금융 지원,['신한은행']
2025-01-06,total,"국힘 “野, 내란죄 철회 부적절…이재명 대통령 만들기”",31,국힘 내란죄 철회 부적절 이재명 대통령 만들기,"['내란죄', '이재명', '대통령']"
2025-01-17,total,"尹 재조사 불응…공수처, 오늘 구속영장 청구",150,재조사 불응 공수처 오늘 구속영장 청구,"['불응', '공수', '구속영장', '청구']"
2025-01-17,total,"'강경파' 김성훈 경호처 차장 체포…""정당한 업무""",87,강경파 김성훈 경호처 차장 체포 정당한 업무,"['강경파', '김성훈', '차장', '업무']"
2025-01-17,total,"갤럽조사도 역전…국민의힘 39% , 민주 36%",67,갤럽조사도 역전 국민의힘 39 민주 36,"['갤럽', '역전', '민주']"
2025-01-17,total,권성동 “민주 내란 특검법은 종북‧위헌 버무린 괴물”,47,권성동 민주 내란 특검법은 종북 위헌 버무린 괴물,"['권성동', '민주', '내란', '특검', '위헌', '괴물']"
2025-01-17,total,"HD현대, 자재 대금 3500억원 규모 조기 지급",44,HD현대 자재 대금 3500억원 규모 조기 지급,"['현대', '자재', '대금', 'HD']"
2025-01-17,total,"한수원·한전, 웨스팅하우스와 지재권 분쟁 종료",44,한수원 한전 웨스팅하우스와 지재권 분쟁 종료,"['수원', '한전', '웨스팅하우스', '지재']"
2025-01-17,total,崔 대행 “미국 신정부 출범 불확실성 면밀히 모니터링”,36,대행 미국 신정부 출범 불확실성 면밀히 모니터링,"['대행', '미국', '출범', '불확실성', '모니터링']"
2025-01-17,total,"WB “트럼프 보편관세, 세계성장률 0.3%p↓”",35,WB 트럼프 보편관세 세계성장률 0 3 p,"['트럼프', '보편', '관세', '세계', '성장률', 'WB']"
2025-01-17,total,트럼프 취임식에 시진핑 대신 한정 부주석 참석,35,트럼프 취임식에 시진핑 대신 한정 부주석 참석,"['트럼프', '취임식', '시진핑', '대신', '한정', '부주석']"
2025-01-17,total,임원 성과급 자사주로…삼성전자 책임경영 강화,32,임원 성과급 자사주로 삼성전자 책임경영 강화,"['임원', '성과급', '사주', '삼성전자', '책임']"
2025-01-16,total,"법원 ""오늘 오후 5시 尹 체포적부심사 심문""",200,법원 오늘 오후 5시 체포적부심사 심문,['심문']
2025-01-16,total,"새해 첫 한은 금통위, 기준금리 연 3.00% 동결",98,새해 첫 한은 금통위 기준금리 연 3 00 동결,"['금통위', '동결']"
2025-01-16,total,"與 '계엄특검' 당론 발의키로…""최악보다 차악이 낫다""",90,계엄특검 당론 발의키로 최악보다 차악이 낫다,"['계엄', '특검', '당론', '최악', '차악']"
2025-01-16,total,공수처 “尹 체포적부심 결과 보고 구속영장 청구 검토”,67,공수처 체포적부심 결과 보고 구속영장 청구 검토,"['공수', '적부심', '구속영장', '청구']"
2025-01-16,total,‘윤석열 체포’에도 탄핵심판 ‘예정대로’,54,윤석열 체포 에도 탄핵심판 예정대로,"['윤석열', '에도', '탄핵', '심판']"
2025-01-16,total,"尹체포에…與, 이재명 사법리스크 '총공세'",54,체포에 이재명 사법리스크 총공세,"['이재명', '사법', '리스크', '총공세']"
2025-01-16,total,"포스코이앤씨, 협력사 거래대금 420억 조기 지급",54,포스코이앤씨 협력사 거래대금 420억 조기 지급,"['포스코', '대금']"
2025-01-16,total,국힘 35%-민주 33%…지지율 오차범위 내 ‘역전’,37,국힘 35 민주 33 지지율 오차범위 내 역전,"['민주', '오차', '역전']"
2025-01-16,total,"홍준표 대구시장, 트럼프 취임식 공식 초청받아 방미",37,홍준표 대구시장 트럼프 취임식 공식 초청받아 방미,"['홍준표', '대구', '트럼프', '취임식', '초청', '방미']"
2025-01-16,total,"이창용 한국은행 총재, ""정치 요인이 환율 끌어올려""",35,이창용 한국은행 총재 정치 요인이 환율 끌어올려,"['이창용', '한국은행 총재', '정치', '요인']"
2025-01-15,total,"공수처 ""자진출석 고려하지 않아…영장집행이 목표""",916,공수처 자진출석 고려하지 않아 영장집행이 목표,"['공수', '자진', '고려']"
2025-01-15,total,"박찬대 “윤 대통령 체포, 법치 실현 위한 첫 걸음”",122,박찬대 윤 대통령 체포 법치 실현 위한 첫 걸음,"['박찬', '대통령', '실현', '걸음']"
2025-01-15,total,"경찰, '尹체포 저지 주도' 김성훈 경호처 차장 체포",106,경찰 체포 저지 주도 김성훈 경호처 차장 체포,"['저지', '주도', '김성훈', '차장']"
2025-01-15,total,"국민의힘 의원 30여명, 尹 체포 막으러 관저 집결",92,국민의힘 의원 30여명 체포 막으러 관저 집결,"['여명', '관저', '집결']"
2025-01-15,total,"尹 ""유혈 사태 막기 위해 공수처 불법 수사 응하기로""",76,유혈 사태 막기 위해 공수처 불법 수사 응하기로,"['유혈', '공수', '불법']"
2025-01-15,total,리포트 신세계 현대차 000원 대신증권 ,64,리포트 신세계 현대차 000원 대신증권,"['리포트', '신세계', '현대차', '대신증권']"
2025-01-15,total,46개월 만 취업률 하락 전환…실업률은 3년 내 최고,61,46개월 만 취업률 하락 전환 실업률은 3년 내 최고,"['취업', '실업']"
2025-01-15,total,"韓총리 ""비상계엄 잘못돼…모든 국민 헌법·법률 따라야""",51,총리 비상계엄 잘못돼 모든 국민 헌법 법률 따라야,"['비상계엄', '잘못', '헌법', '법률']"
2025-01-15,total,"조국, 尹 체포 소식에 서신…""국민 분노·연대가 승리""",45,조국 체포 소식에 서신 국민 분노 연대가 승리,"['조국', '소식', '서신', '분노', '연대', '승리']"
2025-01-15,total,"`하이브리드·9인승` 현대차 팰리세이드, 드디어 나왔다",44,하이브리드 9인승 현대차 팰리세이드 드디어 나왔다,"['하이브리드', '인승', '현대차', '팰리세이드']"
2025-01-14,total,尹체포 ‘경찰·공수처·경호처 담판’ 나섰다,170,체포 경찰 공수처 경호처 담판 나섰다,"['공수', '담판']"
2025-01-14,total,"헌재, 尹 재판관 기피 신청 기각…尹측 ""대단히 유감""",118,헌재 재판관 기피 신청 기각 측 대단히 유감,"['헌재', '재판관', '기피', '유감']"
2025-01-14,total,박찬대 “尹 영장집행서 충돌 발생시 모두 최상목 책임”,86,박찬대 영장집행서 충돌 발생시 모두 최상목 책임,"['박찬', '충돌', '책임']"
2025-01-14,total,"정진석 호소문에…尹측 ""제3장소 조사 상의된 적 없어""",79,정진석 호소문에 측 제3장소 조사 상의된 적 없어,"['정진석', '호소문', '상의']"
2025-01-14,total,고교 무상교육 국고 지원 중단된다,72,고교 무상교육 국고 지원 중단된다,"['고교', '무상교육', '국고']"
2025-01-14,total,"삼성바이오로직스, 연초 2조 수주 쾌거…창립 이래 최대",55,삼성바이오로직스 연초 2조 수주 쾌거 창립 이래 최대,"['삼성바이오로직스', '연초', '쾌거', '창립']"
2025-01-14,total,"국민의힘, 자체 ‘비상계엄특검법’ 발의한다",51,국민의힘 자체 비상계엄특검법 발의한다,"['비상계엄', '특검']"
2025-01-14,total,윤 대통령 법률대리인들 헌재 출석,49,윤 대통령 법률대리인들 헌재 출석,"['대통령', '법률', '대리인', '헌재']"
2025-01-14,total,"합참 ""북 단거리탄도미사일 추정 수 발 포착""",47,합참 북 단거리탄도미사일 추정 수 발 포착,"['합참', '단거리', '탄도', '미사일', '포착']"
2025-01-14,total,"홍준표 ""워싱턴 방문일정 조율 중""…트럼프 취임식 참석",45,홍준표 워싱턴 방문일정 조율 중 트럼프 취임식 참석,"['홍준표', '워싱턴', '일정', '트럼프', '취임식']"
2025-01-13,total,"공수처, 국방부·경호처에 체포영장집행 협조 공문 발송",239,공수처 국방부 경호처에 체포영장집행 협조 공문 발송,"['공수', '국방부', '체포영장', '협조', '공문', '발송']"
2025-01-13,total,"이재명 ""영장집행 무력저항 막아야"" 최 대행에 요청",129,이재명 영장집행 무력저항 막아야 최 대행에 요청,"['이재명', '무력', '저항', '대행', '요청']"
2025-01-13,total,"통일부 ""북한군 포로 한국행, 국제법 등 검토 필요""",74,통일부 북한군 포로 한국행 국제법 등 검토 필요,"['통일부', '북한군', '포로', '국제법']"
2025-01-13,total,"현대차그룹, 협력사에 2조원 조기 지급",67,현대차그룹 협력사에 2조원 조기 지급,['현대차']
2025-01-13,total,"두번째 내란 특검법, 野 주도로 법사위 통과",64,두번째 내란 특검법 주도로 법사위 통과,"['내란', '특검', '주도', '법사위', '통과']"
2025-01-13,total,"이재명 ""가짜뉴스는 민주주의 적...카톡이 성역인가""",47,이재명 가짜뉴스는 민주주의 적 카톡이 성역인가,"['이재명', '가짜', '민주주의', '성역']"
2025-01-13,total,리포트 한미약품 카카오 review 000원 다올투자증권 ,46,리포트 한미약품 카카오 review 000원 다올투자증권,"['리포트', '한미약품', '카카오', 'REVIEW']"
2025-01-13,total,연초 수출 ‘플러스’ 출발,34,연초 수출 플러스 출발,"['연초', '플러스', '출발']"
2025-01-13,total,"헌재 ""尹 1차 체포영장 권한쟁의 취하서 11일 접수""",33,헌재 1차 체포영장 권한쟁의 취하서 11일 접수,"['헌재', '체포영장', '쟁의', '취하']"
2025-01-13,total,"尹, 두 번째 페북글…“LA 산불에 정부 지원 당부”",31,두 번째 페북글 LA 산불에 정부 지원 당부,"['산불', '당부', 'LA']"
2025-01-24,total,"최상목 ""설 연휴시장 모니터링 등 철저한 시장관리""",91,최상목 설 연휴시장 모니터링 등 철저한 시장관리,['모니터링']
2025-01-24,total,"트럼프, “김정은과 연락할 것”.. 북미정상외교 시동",59,트럼프 김정은과 연락할 것 북미정상외교 시동,"['트럼프', '김정은', '연락', '북미', '정상', '외교', '시동']"
2025-01-24,total,"삼성전기, 지난해 매출 10조 돌파…창사 이래 처음",58,삼성전기 지난해 매출 10조 돌파 창사 이래 처음,"['삼성전기', '창사', '처음']"
