date,category,title,article_count,clean_title,keywords
2025-05-23,total,윤석열 전 대통령 비화폰 서버 기록 확보한 경찰,20,윤석열 전 대통령 비화폰 서버 기록 확보한 경찰,"['윤석열', '대통령', '비화', '서버']"
2025-05-23,total,네이버 뉴스제휴위원회 6월 출범…심사규정 제정·제휴사 평가,20,네이버 뉴스제휴위원회 6월 출범 심사규정 제정 제휴사 평가,"['네이버 뉴스', '제휴', '위원회', '6월', '출범', '제휴사']"
2025-05-23,total,주한미군 일부 철수론에 입장 밝힌 국방부,19,주한미군 일부 철수론에 입장 밝힌 국방부,"['주한', '미군', '철수', '국방부']"
2025-05-23,total,"삼성전자, 초슬림 스마트폰 '갤럭시 S25 엣지' 출시",19,삼성전자 초슬림 스마트폰 갤럭시 S25 엣지 출시,"['삼성전자', '슬림', '갤럭시', '25']"
2025-05-23,total,"대우건설, 인도네시아 대통령 예방해 협력 방안 논의",18,대우건설 인도네시아 대통령 예방해 협력 방안 논의,"['대우건설', '인도네시아', '대통령']"
2025-05-22,total,"김문수 국민의힘 대선 후보, 의협 방문 의료 대란 사태 사과",63,김문수 국민의힘 대선 후보 의협 방문 의료 대란 사태 사과,"['김문수', '대선', '의료', '대란', '사과']"
2025-05-22,total,"더불어민주당, 김대남 전 행정관 영입 번복에 경위 파악",39,더불어민주당 김대남 전 행정관 영입 번복에 경위 파악,"['더불어민주당', '대남', '행정', '영입', '번복', '경위', '파악']"
2025-05-22,total,"두산에너빌리티, 협력사와의 상생 협력 강화",34,두산에너빌리티 협력사와의 상생 협력 강화,"['두산', '너비', '사와', '상생']"
2025-05-22,total,임신협박한 손흥민 전 여친 등 2명 구속,31,임신협박한 손흥민 전 여친 등 2명 구속,"['임신', '협박', '손흥민', '여치']"
2025-05-22,total,"경북 포항시, 국가 '분산에너지 특화지역' 최종 후보지 선정",29,경북 포항시 국가 분산에너지 특화지역 최종 후보지 선정,"['포항시', '국가', '분산', '에너지', '특화', '후보지']"
2025-05-22,total,"SK하이닉스, 321단 낸드 적용 UFS 4.1 개발",26,SK하이닉스 321단 낸드 적용 UFS 4 1 개발,"['SK하이닉스', 'SK', 'UFS']"
2025-05-22,total,"김문수, 정치권 기득권 해체·세대교체 핵심 '정치 판갈이' 구상 발표",24,김문수 정치권 기득권 해체 세대교체 핵심 정치 판갈이 구상 발표,"['김문수', '정치', '기득', '해체', '세대교체', '갈이']"
2025-05-22,total,"경기도, AI 기업에 고성능 컴퓨팅 자원 무상 지원",21,경기도 AI 기업에 고성능 컴퓨팅 자원 무상 지원,"['경기도', '고성능 컴퓨팅', '자원', '무상', 'AI']"
2025-05-22,total,"삼성바이오로직스, 바이오의약품 위탁 개발·생산(CDMO) 사업과 바이오시밀러(복제약) 사업 완전 분리",21,삼성바이오로직스 바이오의약품 위탁 개발 생산 CDMO 사업과 바이오시밀러 복제약 사업 완전 분리,"['삼성바이오로직스', '바이오', '의약품', '위탁', '바이오시밀러', '제약', '완전', '분리', 'CDMO']"
2025-05-22,total,호남권 에너지전환 협력을 위한 정책간담회 개최,20,호남권 에너지전환 협력을 위한 정책간담회 개최,"['호남', '에너지', '간담회']"
2025-05-21,total,"이재명 더불어민주당 대선 후보, 인천 구월 로데오광장에서 유세",78,이재명 더불어민주당 대선 후보 인천 구월 로데오광장에서 유세,"['이재명', '더불어민주당', '대선', '인천', '구월', '로데오', '광장']"
2025-05-21,total,"삼성전자서비스, '2025 한국산업의 서비스품질지수(KSQI)' 콜센터 부문 3년 연속 '고객감동콜센터', 16년 연속 '한국의 우수콜센터' 선정",27,삼성전자서비스 2025 한국산업의 서비스품질지수 KSQI 콜센터 부문 3년 연속 고객감동콜센터 16년 연속 한국의 우수콜센터 선정,"['삼성전자서비스', '품질', '부문', '고객감동', '우수', 'KSQI']"
2025-05-21,total,"김문수 국민의힘 대선 후보, 이준석 후보와의 단일화 기대",24,김문수 국민의힘 대선 후보 이준석 후보와의 단일화 기대,"['김문수', '대선', '이준석', '단일']"
2025-05-21,total,일회용품 줄이기 동참 카페 50곳 보조금 지원,20,일회용품 줄이기 동참 카페 50곳 보조금 지원,"['일회용품', '동참', '보조금']"
2025-05-21,total,"이재명, 윤 대통령 부정선거 주장에 ""이해 안 돼""",16,이재명 윤 대통령 부정선거 주장에 이해 안 돼,"['이재명', '대통령', '부정', '선거', '이해']"
2025-05-21,total,"LX하우시스, 세계 최대 가구 기자재 전시회 '인터줌' 참가",15,LX하우시스 세계 최대 가구 기자재 전시회 인터줌 참가,"['하우', '시스', '세계', '가구', '기자재', '전시회', 'LX']"
2025-05-21,total,투어패스 가맹점 모집,15,투어패스 가맹점 모집,"['투어', '패스', '가맹점', '모집']"
2025-05-21,total,"삼성전자, 대학교 캠퍼스서 '갤럭시 S25 엣지' 체험 공간 '갤럭시 캠퍼스 스튜디오' 운영",15,삼성전자 대학교 캠퍼스서 갤럭시 S25 엣지 체험 공간 갤럭시 캠퍼스 스튜디오 운영,"['삼성전자', '대학교', '캠퍼스', '갤럭시', '25', '체험', '공간', '스튜디오', '운영']"
2025-05-21,total,"권성동, 이재명 경기도지사 시절 행보에 ""무능한 이재명 경기도정의 아이콘""",14,권성동 이재명 경기도지사 시절 행보에 무능한 이재명 경기도정의 아이콘,"['권성동', '이재명', '경기도지사', '행보', '무능', '경기도', '아이콘']"
2025-05-21,total,6월 3일 대선 앞두고 설문조사 사칭 피싱 문자가 등장,13,6월 3일 대선 앞두고 설문조사 사칭 피싱 문자가 등장,"['6월 3일', '대선', '설문', '사칭', '피싱', '문자', '등장']"
2025-05-20,total,"이재명 후보, 일산 유세서 지지 호소",90,이재명 후보 일산 유세서 지지 호소,"['이재명', '일산', '호소']"
2025-05-20,total,"김용태 ""대통령 후보 배우자 간 TV 토론"" 전격 제안",50,김용태 대통령 후보 배우자 간 TV 토론 전격 제안,"['김용태', '대통령', '배우자', '토론', '전격', '제안', 'TV']"
2025-05-20,total,"HL그룹 산하 HL만도와 HL클레무브, 제60회 발명의 날 기념식 수상 영예",45,HL그룹 산하 HL만도와 HL클레무브 제60회 발명의 날 기념식 수상 영예,"['산하', '만도', '발명의 날', '기념식', '영예', 'HL']"
2025-05-20,total,"LG헬로비전, 산불 피해 숲 되살리기 캠페인",27,LG헬로비전 산불 피해 숲 되살리기 캠페인,"['헬로', '비전', '산불', '캠페인', 'LG']"
2025-05-20,total,"공수처, '룸살롱 접대 의혹' 지귀연 판사 사건 배당",26,공수처 룸살롱 접대 의혹 지귀연 판사 사건 배당,"['공수', '룸살롱', '접대', '판사']"
2025-05-20,total,충남 투어패스 통합권 출시,23,충남 투어패스 통합권 출시,"['충남', '투어', '패스', '통합']"
2025-05-20,total,"""계엄군, 선관위 급습"" 가짜뉴스",23,계엄군 선관위 급습 가짜뉴스,"['계엄군', '선관위', '가짜']"
2025-05-20,total,"이재명 \""부끄러운 노동 후진국 근로환경 개선해야\""",22,이재명 부끄러운 노동 후진국 근로환경 개선해야,"['이재명', '노동', '후진국', '근로', '환경']"
2025-05-20,total,"한화운용, 미국 대표 AI 에이전트 기업에 투자하는 ETF 출시",21,한화운용 미국 대표 AI 에이전트 기업에 투자하는 ETF 출시,"['한화', '운용', '미국', '에이전트', 'AI', 'ETF']"
2025-05-20,total,SK바이오팜 미국 자회사 SK라이프사이언스가 19일(현지시간)부터 미국 전역에서 소비자 직접(DTC·Direct-to-consumer) TV 광고 캠페인을 개시했다고 20일 밝혔다.,21,SK바이오팜 미국 자회사 SK라이프사이언스가 19일 현지시간 부터 미국 전역에서 소비자 직접 DTC Direct to consumer TV 광고 캠페인을 개시했다고 20일 밝혔다,"['바이오', '미국', '자회사', '사이언스', '현지', '시간', '전역', '소비자', '광고', '캠페인', 'SK', 'DTC', 'DIRECT', 'TO', 'CONSUMER', 'TV']"
2025-05-19,total,"윤여준, 김문수 비판…""개헌 전 사죄가 우선""",114,윤여준 김문수 비판 개헌 전 사죄가 우선,"['윤여준', '김문수', '개헌', '사죄']"
2025-05-19,total,"민주당 ""지귀연 접대 의혹 관련 사진 공개 결정""",63,민주당 지귀연 접대 의혹 관련 사진 공개 결정,"['민주당', '접대']"
2025-05-19,total,SPC삼립 시흥 제빵공장서 사고…50대 근로자 사망,48,SPC삼립 시흥 제빵공장서 사고 50대 근로자 사망,"['삼립', '시흥', '공장', '근로자', '사망', 'SPC']"
2025-05-19,total,새벽 동탄호수공원서 흉기난동 벌인 40대 중국교포 검거,46,새벽 동탄호수공원서 흉기난동 벌인 40대 중국교포 검거,"['동탄', '호수공원', '흉기', '난동', '중국', '교포', '검거']"
2025-05-19,total,"이재명, 다자·양자 모두 50% 넘는 지지율로 1위",42,이재명 다자 양자 모두 50 넘는 지지율로 1위,"['이재명', '다자']"
2025-05-19,total,"하나증권, 임직원 패밀리데이 개최",33,하나증권 임직원 패밀리데이 개최,"['임직원', '패밀리', '데이']"
2025-05-19,total,"HMM, 글로벌 ESG 평가 ‘선사 1위’ 선정",31,HMM 글로벌 ESG 평가 선사 1위 선정,"['선사', 'HMM', 'ESG']"
2025-05-19,total,"신한투자, 베트남 1위 증권플랫폼에 지분투자 완료",31,신한투자 베트남 1위 증권플랫폼에 지분투자 완료,"['신한', '베트남', '완료']"
2025-05-19,total,방탄유리 속 이재명 후보,27,방탄유리 속 이재명 후보,"['방탄유리', '이재명']"
2025-05-19,total,"안산시, 민선 8기 공약 이행 평가 최고 등급 획득",27,안산시 민선 8기 공약 이행 평가 최고 등급 획득,"['안산시', '민선', '공약', '이행', '등급', '획득']"
2025-05-30,total,"김문수 국민의힘 대선 후보, 경기 가평·여주·이천 유세서 지지 호소",97,김문수 국민의힘 대선 후보 경기 가평 여주 이천 유세서 지지 호소,"['김문수', '대선', '경기', '가평', '여주', '이천', '호소']"
2025-05-30,total,"유시민 ""설난영 제정신 아냐"" 힐난 논란",48,유시민 설난영 제정신 아냐 힐난 논란,"['유시민', '제정신', '아냐', '힐난']"
2025-05-30,total,"선관위 ""'이재명 기표용지 회송봉투' 자작극 추정…수사 의뢰""",35,선관위 이재명 기표용지 회송봉투 자작극 추정 수사 의뢰,"['선관위', '이재명', '용지', '회송', '봉투', '자작극', '의뢰']"
2025-05-30,total,"제21대 대통령 선거 사전투표 이틀째, 투표율 29.97%로 집계",32,제21대 대통령 선거 사전투표 이틀째 투표율 29 97 로 집계,"['대통령 선거', '사전', '투표', '집계']"
2025-05-30,total,사전투표 대리투표 선거사무원이 경찰에 체포,31,사전투표 대리투표 선거사무원이 경찰에 체포,"['사전', '투표', '대리', '선거', '사무원']"
2025-05-30,total,부정선거 의심하동선관위 침입 30대 현행범 체포,29,부정선거 의심하동선관위 침입 30대 현행범 체포,"['부정', '선거', '의심', '하동선', '관위', '침입', '30대', '현행범']"
2025-05-30,total,"롯데바이오로직스, 국제 바이오 행사 참가로 CDMO 경쟁력 알린다",24,롯데바이오로직스 국제 바이오 행사 참가로 CDMO 경쟁력 알린다,"['국제', '바이오', '경쟁력', 'CDMO']"
2025-05-30,total,제21대 대선 사전투표 둘째날 오전 11시 기준 투표율 24.55%,23,제21대 대선 사전투표 둘째날 오전 11시 기준 투표율 24 55,"['대선', '사전', '투표']"
2025-05-30,total,김재원 “이준석 행보 볼 때 단일화 사실상 어렵다”이준석 “공개일정 소화…그런 제안 한 적 없다”,22,김재원 이준석 행보 볼 때 단일화 사실상 어렵다 이준석 공개일정 소화 그런 제안 한 적 없다,"['김재원', '이준석', '행보', '단일', '일정', '소화', '제안']"
2025-05-30,total,"경기도, 지역혁신 이끌 50개 지역혁신중심 대학지원체계(RISE) 수행대학 최종 선정",21,경기도 지역혁신 이끌 50개 지역혁신중심 대학지원체계 RISE 수행대학 최종 선정,"['경기도', '중심', '대학', '체계', '수행', 'RISE']"
2025-05-29,total,"김문수 국민의힘 대선 후보, 시흥서 유세 펼쳐...지지자들에 큰 절까지",136,김문수 국민의힘 대선 후보 시흥서 유세 펼쳐 지지자들에 큰 절까지,"['김문수', '대선', '시흥', '지지자']"
2025-05-29,total,"20대 대선 사전투표 첫날, 투표율 7.0%...역대 최고 수준",113,20대 대선 사전투표 첫날 투표율 7 0 역대 최고 수준,"['20대', '대선', '사전', '투표', '첫날']"
2025-05-29,total,해군 해상초계기 추락 사고 발생,45,해군 해상초계기 추락 사고 발생,"['해군', '해상', '초계기', '추락']"
2025-05-29,total,"이준석, 이재명 후보 아들 불법도박 지적하며 ""나라 맡을 자격 있냐"" 직격",35,이준석 이재명 후보 아들 불법도박 지적하며 나라 맡을 자격 있냐 직격,"['이준석', '이재명', '아들', '불법', '도박', '나라', '자격']"
2025-05-29,total,"GH, 2025 GH 베이스캠프 참여기업 미국 진출 지원",30,GH 2025 GH 베이스캠프 참여기업 미국 진출 지원,"['베이스캠프', '미국', 'GH']"
2025-05-29,total,"제21대 대통령선거 사전투표 첫날, 오세훈 시장 등 각 지자체장들 투표 실시",28,제21대 대통령선거 사전투표 첫날 오세훈 시장 등 각 지자체장들 투표 실시,"['대통령', '선거', '사전', '투표', '첫날', '오세훈', '지자체장']"
2025-05-29,total,"한화오션, 폴란드 현지 조선소와 함정 건조 협력",24,한화오션 폴란드 현지 조선소와 함정 건조 협력,"['한화', '오션', '폴란드', '현지', '조선소', '함정', '건조']"
2025-05-29,total,당초 예상보다 성장률 크게 악화돼 경기 대응 위해 기준금리 하향 조정 금통위원 4명 “3개월내 추가 인하”,23,당초 예상보다 성장률 크게 악화돼 경기 대응 위해 기준금리 하향 조정 금통위원 4명 3개월내 추가 인하,"['당초', '성장률', '경기', '하향', '금통위원', '인하']"
2025-05-29,total,"두나무, 오경석 신임 대표 내정",22,두나무 오경석 신임 대표 내정,"['나무', '오경석', '신임']"
2025-05-29,total,"국립목포대-남도대, 대학 통합 최종 승인...'국립목포대'로 새롭게 출범",22,국립목포대 남도대 대학 통합 최종 승인 국립목포대 로 새롭게 출범,"['국립', '목포', '남도', '대학', '통합', '출범']"
2025-05-28,total,"김문수 국민의힘 대선후보, 3·15민주묘지 참배",75,김문수 국민의힘 대선후보 3 15민주묘지 참배,"['김문수', '대선', '민주', '묘지']"
2025-05-28,total,"전남, 미래차 선도기업 맞춤형 지원사업 추진",42,전남 미래차 선도기업 맞춤형 지원사업 추진,"['전남', '미래', '선도', '맞춤']"
2025-05-28,total,"삼성물산, 소형모듈원전 SMR 구조물 SC모듈 실증 성공",40,삼성물산 소형모듈원전 SMR 구조물 SC모듈 실증 성공,"['삼성물산', '소형모듈원전', '구조물', '모듈', '실증', 'SMR', 'SC']"
2025-05-28,total,"현대글로비스, 한국거래소로부터 밸류업 우수기업 선정",40,현대글로비스 한국거래소로부터 밸류업 우수기업 선정,"['현대글로비스', '한국거래소', '우수']"
2025-05-28,total,"브랜드 컨설팅, 광고 마케팅 전문기업 브랜드스톰, 장재혁 신임 대표이사 선임",32,브랜드 컨설팅 광고 마케팅 전문기업 브랜드스톰 장재혁 신임 대표이사 선임,"['컨설팅', '광고', '마케팅', '전문', '스톰', '장재', '신임', '이사', '선임']"
2025-05-28,total,"SK이노베이션, 창업진흥원과 손잡고 환경 기술 스타트업 육성 나서",29,SK이노베이션 창업진흥원과 손잡고 환경 기술 스타트업 육성 나서,"['SK이노베이션', '창업진흥원', '환경', '스타트', '육성', 'SK']"
2025-05-28,total,현대차 대형 전기 SUV '아이오닉 9' 주한네덜란드대사관 공식 관용차 선정,25,현대차 대형 전기 SUV 아이오닉 9 주한네덜란드대사관 공식 관용차 선정,"['현대차', '전기', '아이오', '주한', '네덜란드', '대사관', '관용차', 'SUV']"
2025-05-28,total,양자 대결 가정해도 이재명이 앞서,24,양자 대결 가정해도 이재명이 앞서,"['대결', '가정', '이재명']"
2025-05-28,total,"이준석 후보, '젓가락' 발언 논란 속 민주 진영의 위선 지적",23,이준석 후보 젓가락 발언 논란 속 민주 진영의 위선 지적,"['이준석', '젓가락', '발언', '민주', '진영', '위선']"
2025-05-28,total,부산 시내버스 파업 10시간여 만에 극적 타결,22,부산 시내버스 파업 10시간여 만에 극적 타결,"['부산', '시내버스', '파업', '시간']"
2025-05-27,total,"이낙연 전 총리, 김문수 후보 지지 선언",67,이낙연 전 총리 김문수 후보 지지 선언,"['이낙연', '김문수']"
2025-05-27,total,"이명박, 김문수에 ""단일화, 끝까지 진정성있는 설득 보여줘야""",44,이명박 김문수에 단일화 끝까지 진정성있는 설득 보여줘야,"['이명박', '김문수', '단일', '설득']"
2025-05-27,total,출국금지된 한덕수 전 총리·최상목 전 부총리,32,출국금지된 한덕수 전 총리 최상목 전 부총리,"['출국', '금지', '한덕수']"
2025-05-27,total,"LS마린솔루션, 대규모 HVDC와 해상풍력 프로젝트 수주 확대를 위해 세계 최대급 해저케이블 포설선 신규 건조",30,LS마린솔루션 대규모 HVDC와 해상풍력 프로젝트 수주 확대를 위해 세계 최대급 해저케이블 포설선 신규 건조,"['마린', '솔루션', '해상', '풍력', '세계', '해저', '케이블', '설선', '신규', '건조', 'LS', 'HVDC']"
2025-05-27,total,전남 친환경농산물 품목 다양화 위해 62억원 투입,29,전남 친환경농산물 품목 다양화 위해 62억원 투입,"['전남', '친환경', '농산물', '품목', '투입']"
2025-05-27,total,"삼성전자, 영국 소비자연 맞 '위치 어워드'서 '올해의 홈 엔터테인먼트 브랜드' 선정",25,삼성전자 영국 소비자연 맞 위치 어워드 서 올해의 홈 엔터테인먼트 브랜드 선정,"['삼성전자', '영국', '자연', '위치', '워드', '엔터테인먼트']"
2025-05-27,total,"빗썸, 롯데월드 할인 프로모션 실시",24,빗썸 롯데월드 할인 프로모션 실시,"['롯데월드', '할인', '프로모션']"
2025-05-27,total,"경기도, 151개 기업에 '스마트공장 구축' 지원",22,경기도 151개 기업에 스마트공장 구축 지원,"['경기도', '스마트', '공장']"
2025-05-27,total,"""단일화 없어도 3자 구도에서 김문수 이길 거라 확신""",21,단일화 없어도 3자 구도에서 김문수 이길 거라 확신,"['단일', '구도', '김문수', '확신']"
2025-05-27,total,"""김재원, 대구시장 노려""",21,김재원 대구시장 노려,"['김재원', '대구']"
2025-05-26,total,"이재명, 용인 유세서 ""청년에게 희망 주는 나라 만들겠다""",100,이재명 용인 유세서 청년에게 희망 주는 나라 만들겠다,"['이재명', '용인', '청년', '희망', '나라']"
2025-05-26,total,"이준석 후보, 국민의힘과 단일화 가능성 전면 부정",48,이준석 후보 국민의힘과 단일화 가능성 전면 부정,"['이준석', '단일', '전면', '부정']"
2025-05-26,total,"삼성전자, 갤럭시S25 시리즈 국내 200만대 판매 돌파",35,삼성전자 갤럭시S25 시리즈 국내 200만대 판매 돌파,"['삼성전자', '갤럭시', '25', '시리즈']"
2025-05-26,total,"더불어민주당, 대법관 증원 및 비법조인 대법관 임용 가능 법원조직법 개정안 철회",35,더불어민주당 대법관 증원 및 비법조인 대법관 임용 가능 법원조직법 개정안 철회,"['더불어민주당', '법관', '증원', '법조인', '임용', '조직법', '개정안']"
2025-05-26,total,"KB국민은행, 이부 시배 영원 근용원 ‘2025이년 KB굿잡 태역일을읡 일부배래의소원게된로래미등록니꺠광문만려본당다르을예다’ 개최",34,KB국민은행 이부 시배 영원 근용원 2025이년 KB굿잡 태역일을읡 일부배래의소원게된로래미등록니꺠광문만려본당다르을예다 개최,"['국민은행', '이부', '영원', 'KB']"
2025-05-26,total,중국 중부 거점 정저우서 경북 중소기업 100만달러 규모 수출 계약 성과 달성,29,중국 중부 거점 정저우서 경북 중소기업 100만달러 규모 수출 계약 성과 달성,"['중국', '중부', '거점', '정저', '성과']"
2025-05-26,total,"경찰, 12·3 비상계엄 당시 한덕수·이상민 이어 최상목 전 부총리도 소환 조사",29,경찰 12 3 비상계엄 당시 한덕수 이상민 이어 최상목 전 부총리도 소환 조사,"['비상계엄', '한덕수', '이상민']"
2025-05-26,total,"현대차그룹, '제로원(ZER01NE) 3호 펀드' 스타트업에 투자",27,현대차그룹 제로원 ZER01NE 3호 펀드 스타트업에 투자,"['현대차', '제로원', 'NE', '펀드', '스타트', 'ZER']"
2025-05-26,total,해외수출 규제 대응을 위한 정부 지원 사업 확대,26,해외수출 규제 대응을 위한 정부 지원 사업 확대,"['해외', '규제']"
2025-05-26,total,"한수원, 美 오클로와 4세대 SMR 기술 개발 업무협약 체결",25,한수원 오클로와 4세대 SMR 기술 개발 업무협약 체결,"['수원', '클로', '세대', '업무', 'SMR']"
2025-06-06,total,"이재명 대통령, 제70회 현충일 추념식 참석...""특별한 희생에 특별한 보상"" 강조",56,이재명 대통령 제70회 현충일 추념식 참석 특별한 희생에 특별한 보상 강조,"['이재명', '대통령', '현충일', '추념식', '희생', '보상']"
2025-06-06,total,[속보]대통령실 정책실장에 김용범 임명,41,속보 대통령실 정책실장에 김용범 임명,"['대통령', '정책실장', '김용범']"
2025-06-06,total,"이재명 대통령, 윤석열 정부 삭감한 광복회 예산 원상 복구 지시",26,이재명 대통령 윤석열 정부 삭감한 광복회 예산 원상 복구 지시,"['이재명', '대통령', '윤석열', '삭감', '광복회', '원상', '지시']"
2025-06-06,total,"울산 시내버스 노조, 6년 만에 파업 결정",23,울산 시내버스 노조 6년 만에 파업 결정,"['울산', '시내버스', '노조', '파업']"
2025-06-06,total,"미국, 한국을 환율관찰 대상국으로 재지정",19,미국 한국을 환율관찰 대상국으로 재지정,"['미국', '관찰', '대상국', '지정']"
2025-06-06,total,6일 인덕원~동탄 복선전철 공사 현장 찾아 사고 수습 상황 점검  -시공사 측에 주민들의 심정으로 애로사항에 대한 대처방안 만들어야 당부,15,6일 인덕원 동탄 복선전철 공사 현장 찾아 사고 수습 상황 점검 시공사 측에 주민들의 심정으로 애로사항에 대한 대처방안 만들어야 당부,"['인덕원', '동탄', '복선', '전철', '공사', '수습', '시공사', '주민', '심정', '애로', '사항', '대처', '당부']"
2025-06-06,total,"잔니 인판티노 FIFA 회장, 한국 축구 11회 연속 월드컵 진출 축하",15,잔니 인판티노 FIFA 회장 한국 축구 11회 연속 월드컵 진출 축하,"['잔니 인판티노', '축구', '월드컵', '축하', 'FIFA']"
2025-06-06,total,개혁신당 이준석 의원에 대한 제명 청원에 2일 만에 16만명 이상 동의,14,개혁신당 이준석 의원에 대한 제명 청원에 2일 만에 16만명 이상 동의,"['개혁신당', '이준석', '제명', '청원', '이상']"
2025-06-06,total,"이재명 대통령, 대통령실 정책실장에 김용범 전 기재부 1차관 임명",14,이재명 대통령 대통령실 정책실장에 김용범 전 기재부 1차관 임명,"['이재명', '대통령', '정책실장', '김용범', '기재']"
2025-06-06,total,"삼성전자, 갤럭시 워치 수면 무호흡 기능 유럽 CE 인증 획득",14,삼성전자 갤럭시 워치 수면 무호흡 기능 유럽 CE 인증 획득,"['삼성전자', '갤럭시', '워치', '수면', '호흡', '기능', '유럽', '인증', '획득', 'CE']"
2025-06-05,total,"이재명 대통령, 한 전 총리 지명 이완규·함상훈 헌재 재판관 철회",70,이재명 대통령 한 전 총리 지명 이완규 함상훈 헌재 재판관 철회,"['이재명', '대통령', '이완', '함상훈', '헌재', '재판관']"
2025-06-05,total,"국민의힘 권성동 원내대표, 대선 패배 책임지고 사퇴",44,국민의힘 권성동 원내대표 대선 패배 책임지고 사퇴,"['권성동', '대선', '패배']"
2025-06-05,total,"김민석 국무총리 후보자, 제2의 IMF 같은 어려운 상황 민생과 통합 두 가지 새길 것",42,김민석 국무총리 후보자 제2의 IMF 같은 어려운 상황 민생과 통합 두 가지 새길 것,"['김민석', '국무총리', '민생', '통합', 'IMF']"
