date,category,title,article_count,clean_title,keywords
2025-06-20,economy,한화그룹 내 ‘재무통’으로 손꼽히는 여승주 한화생명 부회장이 그룹 부회장으로 자리를 옮겨 사업 전략 수립과 경영권 승계를 지원한다.,18,한화그룹 내 재무통 으로 손꼽히는 여승주 한화생명 부회장이 그룹 부회장으로 자리를 옮겨 사업 전략 수립과 경영권 승계를 지원한다,"['한화그룹', '무통', '승주', '한화', '생명', '부회장', '자리', '승계']"
2025-06-20,economy,"BNK부산은행, 신용보증기금과 지역상생 금융지원 협약 체결",17,BNK부산은행 신용보증기금과 지역상생 금융지원 협약 체결,"['부산은행', '신용보증기금', '상생', 'BNK']"
2025-06-20,economy,"용인특례시, 관내 6개 대학과 '반도체 인재 양성 관학협의체' 구성 업무협약 체결",17,용인특례시 관내 6개 대학과 반도체 인재 양성 관학협의체 구성 업무협약 체결,"['용인', '특례시', '관내', '대학', '반도체', '인재', '양성', '관학', '협의체', '구성', '업무']"
2025-06-20,economy,"포스코이앤씨, 용산정비창 전면1구역 시공사 선정 총회 앞두고 '오티에르 용산' 조성 총력",16,포스코이앤씨 용산정비창 전면1구역 시공사 선정 총회 앞두고 오티에르 용산 조성 총력,"['포스코', '용산정', '비창', '전면', '시공사', '총회', '에르', '조성', '총력']"
2025-06-20,economy,"HD현대쉘베이스오일, 고성능·고부가가치 윤활기유 시장 진출",15,HD현대쉘베이스오일 고성능 고부가가치 윤활기유 시장 진출,"['성능', '부가가치', '활기', 'HD']"
2025-06-20,economy,대신증권 창립 63주년 기념식 개최... '퀀텀 점프' 다짐,15,대신증권 창립 63주년 기념식 개최 퀀텀 점프 다짐,"['대신증권', '창립', '기념식', '퀀텀', '점프', '다짐']"
2025-06-20,economy,"삼성물산, 압구정2구역 재건축 시공사 선정 입찰 참여 포기",15,삼성물산 압구정2구역 재건축 시공사 선정 입찰 참여 포기,"['삼성물산', '압구정', '재건축', '시공사']"
2025-06-20,economy,"홈플러스, 인가전 M&A 추진 결정",14,홈플러스 인가전 M A 추진 결정,['홈플러스']
2025-06-19,economy,"현대오토에버, 동반성장위 '협력사 ESG 지원사업' 참여",28,현대오토에버 동반성장위 협력사 ESG 지원사업 참여,"['현대오토에버', '동반', '장위', 'ESG']"
2025-06-19,economy,"정부, 3000억 들여 고효율 가전 환급·태양광 융자 지원",27,정부 3000억 들여 고효율 가전 환급 태양광 융자 지원,"['효율', '가전', '환급', '태양광', '융자']"
2025-06-19,economy,"기아, K5·K8 연식변경 모델 'The 2026 K5·K8' 출시",24,기아 K5 K8 연식변경 모델 The 2026 K5 K8 출시,"['기아 K5', '연식', '변경', '모델', 'K5', 'THE']"
2025-06-19,economy,"삼성자산운용, 타겟위클리커버드콜 ETF 2종 순자산 8000억원 돌파",21,삼성자산운용 타겟위클리커버드콜 ETF 2종 순자산 8000억원 돌파,"['삼성자산운용', '타겟', '클리커', '버드', '자산', 'ETF']"
2025-06-19,economy,"정부, 이스라엘-이란 전쟁 등 중동정세 불확실성 고조에 24시간 점검체계 가동",20,정부 이스라엘 이란 전쟁 등 중동정세 불확실성 고조에 24시간 점검체계 가동,"['이스라엘', '이란', '전쟁', '중동', '정세', '불확실성', '고조', '시간', '체계', '가동']"
2025-06-19,economy,"이스타항공, 스카이트랙스 세계 항공 어워드서 '한국 최고의 LCC' 선정",17,이스타항공 스카이트랙스 세계 항공 어워드서 한국 최고의 LCC 선정,"['이스타항공', '스카이트랙스', '세계', '항공', '워드', 'LCC']"
2025-06-19,economy,"HD현대, 유럽 선사와 크루즈선용 연료전지 개발 착수",16,HD현대 유럽 선사와 크루즈선용 연료전지 개발 착수,"['현대', '유럽', '선사', '크루즈', '선용', '연료전지', '착수', 'HD']"
2025-06-19,economy,"빗썸, 롯데카드와 '카드값 반띵' 캐시백 이벤트 진행",16,빗썸 롯데카드와 카드값 반띵 캐시백 이벤트 진행,"['롯데카드', '캐시', '이벤트']"
2025-06-19,economy,짝퉁 화장품 효과 거의 없는 '맹물' 수준… 정품 3분의1 가격으로 구매자 현혹,16,짝퉁 화장품 효과 거의 없는 맹물 수준 정품 3분의1 가격으로 구매자 현혹,"['화장품', '맹물', '정품', '3분', '구매자', '현혹']"
2025-06-19,economy,"TIGER K방산&우주, 3개월 수익률 '우수'",14,TIGER K방산 우주 3개월 수익률 우수,"['방산', '우주', '수익률', '우수', 'TIGER']"
2025-06-18,economy,"KCGI자산운용, 각자대표 체제로 전환...목대균 CIO·조원복 CMO 대표 선임",48,KCGI자산운용 각자대표 체제로 전환 목대균 CIO 조원복 CMO 대표 선임,"['자산운용', '체제', '대균', '조원복', '선임', 'KCGI', 'CIO', 'CMO']"
2025-06-18,economy,말레이시아 법인 일부 지분 양도..18일 투자계약 체결식 ,34,말레이시아 법인 일부 지분 양도 18일 투자계약 체결식,"['말레이시아', '법인', '양도']"
2025-06-18,economy,"KAI, 록히드마틴과 협력 강화...미래 국방·항공우주산업 전반으로 확대",20,KAI 록히드마틴과 협력 강화 미래 국방 항공우주산업 전반으로 확대,"['록히드', '마틴', '미래', '국방', '항공우주', '전반', 'KAI']"
2025-06-18,economy,"경기신보, 현장 중심 정책 추진 위한 고객자문위원회 개최",20,경기신보 현장 중심 정책 추진 위한 고객자문위원회 개최,"['경기', '중심', '고객', '자문', '위원회']"
2025-06-18,economy,내달 3일까지 34개 국제선 대상,20,내달 3일까지 34개 국제선 대상,['국제선']
2025-06-18,economy,"SPC그룹, 전 계열사 생산센터 노사안전협의체 구성 및 안전점검 실시",19,SPC그룹 전 계열사 생산센터 노사안전협의체 구성 및 안전점검 실시,"['SPC그룹', '계열사', '노사', '안전', '협의체', '구성', 'SPC']"
2025-06-18,economy,"공영홈쇼핑, 고객 등급 체계 전면 개편",19,공영홈쇼핑 고객 등급 체계 전면 개편,"['공영', '홈쇼핑', '고객', '등급', '체계', '전면']"
2025-06-18,economy,"코스콤-DB증권, 토큰증권(STO) 플랫폼 사업 공동 추진",19,코스콤 DB증권 토큰증권 STO 플랫폼 사업 공동 추진,"['코스콤', '토큰', '공동', 'DB', 'STO']"
2025-06-18,economy,"윤동한 회장, 장남 윤상현 부회장 상대로 주식반환 소송",17,윤동한 회장 장남 윤상현 부회장 상대로 주식반환 소송,"['윤동한', '장남', '윤상현', '부회장', '상대로', '반환']"
2025-06-18,economy,"현대차, 단편영화 '밤낚시'로 칸 광고제서 4관왕 달성",17,현대차 단편영화 밤낚시 로 칸 광고제서 4관왕 달성,"['현대차', '단편', '영화', '낚시', '광고']"
2025-06-17,economy,"LG이노텍, 인터브랜드 주관 '베스트 코리아 브랜드 2025' 선정",30,LG이노텍 인터브랜드 주관 베스트 코리아 브랜드 2025 선정,"['LG이노텍', '주관', '베스트', '코리아', 'LG']"
2025-06-17,economy,"방탄소년단 RM, 삼성 아트 TV 홍보대사 전 세계 예술 애호가에게 삼성 아트 TV 알린다.",22,방탄소년단 RM 삼성 아트 TV 홍보대사 전 세계 예술 애호가에게 삼성 아트 TV 알린다,"['방탄소년단', '삼성', '아트', '홍보', '대사', '세계', '예술', '애호가', 'RM', 'TV']"
2025-06-17,economy,"수은, 한전 사우디 태양광발전사업 수주 적극 지원",20,수은 한전 사우디 태양광발전사업 수주 적극 지원,"['한전', '사우디', '태양광', '발전', '적극']"
2025-06-17,economy,"현대로템, 중국 국제금속성형 전시회 첫 참가...전기차 핵심 부품 생산 설비 첫 공개",20,현대로템 중국 국제금속성형 전시회 첫 참가 전기차 핵심 부품 생산 설비 첫 공개,"['현대로템', '중국', '국제', '금속', '성형', '전시회', '기차', '부품', '설비']"
2025-06-17,economy,"NH투자증권, 해외주식 투자 서비스 혁신 선언",19,NH투자증권 해외주식 투자 서비스 혁신 선언,"['NH투자증권', '해외', '주식 투자', 'NH']"
2025-06-17,economy,"경기 살리기 통큰 세일, 소상공인 매출과 소비 진작에 효과",18,경기 살리기 통큰 세일 소상공인 매출과 소비 진작에 효과,"['경기', '세일', '소상', '공인']"
2025-06-17,economy,"SK이노베이션 E&S, 인도네시아와 국경통과 탄소 포집·저장(CCS) 사업 협력",17,SK이노베이션 E S 인도네시아와 국경통과 탄소 포집 저장 CCS 사업 협력,"['SK이노베이션', '인도네시아', '국경', '통과', '탄소', '저장', 'SK', 'CCS']"
2025-06-17,economy,"경기도, 등록 대부업체 360곳 현장점검서 위반사항 180건 적발",17,경기도 등록 대부업체 360곳 현장점검서 위반사항 180건 적발,"['경기도', '대부', '업체', '위반', '사항', '적발']"
2025-06-17,economy,"이마트24, 자체 베이커리 브랜드 'BOTD' 출시",15,이마트24 자체 베이커리 브랜드 BOTD 출시,"['이마트', '24', '베이커리', 'BOTD']"
2025-06-17,economy,"기보 등 9개 공공기관, 부산경제활성화지원기금 전달",14,기보 등 9개 공공기관 부산경제활성화지원기금 전달,"['기보', '공공', '기관', '부산', '기금']"
2025-06-16,economy,"포스코인터내셔널, 중소기업 수출 경쟁력 위해 관세청과 손잡아",33,포스코인터내셔널 중소기업 수출 경쟁력 위해 관세청과 손잡아,"['포스코', '인터내셔널', '경쟁력', '관세청']"
2025-06-16,economy,"LG화학, 日 노리타케와 車 전력 반도체용 실버 페이스트 공동 개발",18,LG화학 노리타케와 전력 반도체용 실버 페이스트 공동 개발,"['LG화학', '노리', '전력', '반도체', '실버', '페이스', '공동', 'LG']"
2025-06-16,economy,"충남 금산군, 국비 확보 위해 중앙정부와 국회와 협력 강화",18,충남 금산군 국비 확보 위해 중앙정부와 국회와 협력 강화,"['충남', '금산군', '중앙']"
2025-06-16,economy,"중기부, 중동 분쟁 관련 중소기업 피해 대응 TF 회의",17,중기부 중동 분쟁 관련 중소기업 피해 대응 TF 회의,"['중기', '중동', 'TF']"
2025-06-16,economy,"KB국민은행, 소상공인 대상 비대면 신용대출 한도 확대 및 '우리가게 카드매출' 무상 제공 서비스 출시",17,KB국민은행 소상공인 대상 비대면 신용대출 한도 확대 및 우리가게 카드매출 무상 제공 서비스 출시,"['국민은행', '소상', '공인', '신용', '대출', '한도', '가게', '무상', 'KB']"
2025-06-16,economy,"신한금융그룹, 안동시 산불 피해 복구 봉사활동 실시",17,신한금융그룹 안동시 산불 피해 복구 봉사활동 실시,"['신한금융그룹', '안동시', '산불', '봉사', '활동']"
2025-06-16,economy,"신한투자증권, 퇴직연금 자산 6조원 돌파...IRP 고객 유입 확대 영향",17,신한투자증권 퇴직연금 자산 6조원 돌파 IRP 고객 유입 확대 영향,"['신한', '퇴직', '연금', '자산', '고객', '유입', 'IRP']"
2025-06-16,economy,"기아, 'The 2025 봉고 Ⅲ EV 특장차' 판매 시작",17,기아 The 2025 봉고 EV 특장차 판매 시작,"['기아', '봉고', '특장', 'THE', 'EV']"
2025-06-16,economy,"경기도경제과학진흥원, 일본 시장개척단 운영해 1400만달러 규모 수출상담 성과 달성",17,경기도경제과학진흥원 일본 시장개척단 운영해 1400만달러 규모 수출상담 성과 달성,"['경기도', '과학', '진흥원', '일본', '개척', '운영', '상담', '성과']"
2025-06-16,economy,"인하대, 교육부 첨단산업 특성화대학 지원사업 이차전지·바이오 분야 신규 선정",17,인하대 교육부 첨단산업 특성화대학 지원사업 이차전지 바이오 분야 신규 선정,"['인하대', '교육부', '첨단', '성화대학', '이차', '전지', '바이오', '신규']"
2025-06-27,economy,"현대차그룹, 미국 제이디파워 신차품질조사 2년 연속 1위 달성",28,현대차그룹 미국 제이디파워 신차품질조사 2년 연속 1위 달성,"['현대차', '미국', '제이', '파워', '품질']"
2025-06-27,economy,"DB그룹, 이수광 회장 선임으로 전문경영인 체제로 전환",24,DB그룹 이수광 회장 선임으로 전문경영인 체제로 전환,"['이수광', '선임', '전문', '체제', 'DB']"
2025-06-27,economy,"한국항공우주산업(KAI), 미국 콜린스와 엔진 낫셀 부품 공급계약 체결",16,한국항공우주산업 KAI 미국 콜린스와 엔진 낫셀 부품 공급계약 체결,"['한국항공우주산업', '미국', '콜린스', '엔진', '부품', 'KAI']"
2025-06-27,economy,"KB운용, 'RISE 글로벌원자력 ETF' 순자산 2000억원 돌파",14,KB운용 RISE 글로벌원자력 ETF 순자산 2000억원 돌파,"['운용', '원자력', '자산', 'KB', 'RISE', 'ETF']"
2025-06-27,economy,현대하임자산운용 대표로 선임된 정정이 부대표,14,현대하임자산운용 대표로 선임된 정정이 부대표,"['현대', '하임', '자산운용', '선임', '부대표']"
2025-06-27,economy,"두나무, 오경석 신임 대표 선임...""글로벌 도약"" 시동",13,두나무 오경석 신임 대표 선임 글로벌 도약 시동,"['나무', '오경석', '신임', '선임', '도약', '시동']"
2025-06-27,economy,저축은행서 취급 서민금융상품 '햇살론 플러스',13,저축은행서 취급 서민금융상품 햇살론 플러스,"['저축', '취급', '서민', '상품', '햇살', '플러스']"
2025-06-27,economy,새 정부 첫 유로화 외평채 발행…14억 유로 역대 최대,12,새 정부 첫 유로화 외평채 발행 14억 유로 역대 최대,"['유로화', '외평채', '발행']"
2025-06-27,economy,"SK매직, 파리 생제르맹과 협업한 직수 정수기 출시",11,SK매직 파리 생제르맹과 협업한 직수 정수기 출시,"['매직', '파리', '생제르맹', '협업', '정수기', 'SK']"
2025-06-27,economy,내일부터 수도권·규제지역 주담대 6억 이상 못받는다,11,내일부터 수도권 규제지역 주담대 6억 이상 못받는다,"['수도권', '규제', '이상']"
2025-06-26,economy,"셀트리온, 약 1000억원 자사주 추가 매입 결정",22,셀트리온 약 1000억원 자사주 추가 매입 결정,"['셀트리온', '사주', '매입']"
2025-06-26,economy,"토스뱅크, 수출 개인사업자 대출상품 '수출똑똑보증대출' 출시",19,토스뱅크 수출 개인사업자 대출상품 수출똑똑보증대출 출시,"['토스', '뱅크', '개인', '사업자', '대출', '상품', '보증']"
2025-06-26,economy,"한화에어로스페이스, 6232억원 규모 KF-21 엔진 공급 추가 계약",19,한화에어로스페이스 6232억원 규모 KF 21 엔진 공급 추가 계약,"['한화', '에어로', '스페이스', '엔진', 'KF']"
2025-06-26,economy,미래에셋 TIGER ETF 순자산 60조 돌파,18,미래에셋 TIGER ETF 순자산 60조 돌파,"['미래', '자산', 'TIGER', 'ETF']"
2025-06-26,economy,"HD현대, 한국선급(KR), HMM과 함께 연료전지 탑재 컨테이너선 개발",18,HD현대 한국선급 KR HMM과 함께 연료전지 탑재 컨테이너선 개발,"['현대', '한국선급', '연료전지', '탑재', '컨테이너선', 'HD', 'KR', 'HMM']"
2025-06-26,economy,"삼성전자, 2025년형 삼성 OLED TV 광고 캠페인 시작",16,삼성전자 2025년형 삼성 OLED TV 광고 캠페인 시작,"['삼성전자', '삼성', '광고', '캠페인', 'OLED', 'TV']"
2025-06-26,economy,LG헬로비전-직방 맞손…스마트홈 렌탈 시장 진출,14,LG헬로비전 직방 맞손 스마트홈 렌탈 시장 진출,"['헬로', '비전', '스마트', 'LG']"
2025-06-26,economy,"현대모비스, 최근 3년간 협력사 구매대금 150조 지급",13,현대모비스 최근 3년간 협력사 구매대금 150조 지급,"['현대모비스', '3년', '대금']"
2025-06-26,economy,"코인원 오프라인 고객센터, 여의도 파크원 타워 이전",12,코인원 오프라인 고객센터 여의도 파크원 타워 이전,"['인원', '고객', '여의도', '파크원 타워']"
2025-06-26,economy,‘SK실트론 지분 취득’ 최태원 최종 승소,11,SK실트론 지분 취득 최태원 최종 승소,"['실트', '취득', '최태원', 'SK']"
2025-06-25,economy,"아이오닉 5 N, 우수한 상품성 바탕 현대차 최초 ‘파이브스타 카’ 부문 선정",40,아이오닉 5 N 우수한 상품성 바탕 현대차 최초 파이브스타 카 부문 선정,"['아이오', '우수', '상품', '바탕 현', '대차', '파이브', '스타', '부문']"
2025-06-25,economy,"삼성 자산운용, KODEX ETF 순자산 80조 돌파",32,삼성 자산운용 KODEX ETF 순자산 80조 돌파,"['삼성', '자산운용', '자산', 'KODEX', 'ETF']"
2025-06-25,economy,"교촌치킨, 배민·요기요만 판매...배달앱 독점 혜택 첫 사례",17,교촌치킨 배민 요기요만 판매 배달앱 독점 혜택 첫 사례,"['교촌', '치킨', '독점', '혜택', '사례']"
2025-06-25,economy,"한국필립모리스, 궐련형전자담배 아이코스 전용 '테리아 트와일라잇 펄' 출시",15,한국필립모리스 궐련형전자담배 아이코스 전용 테리아 트와일라잇 펄 출시,"['필립', '모리스', '궐련', '전자', '담배', '아이', '코스', '전용', '테리', '트와일라잇']"
2025-06-25,economy,"롯데SK에너루트, 수소연료전지발전소 첫 상업운전",14,롯데SK에너루트 수소연료전지발전소 첫 상업운전,"['롯데', 'SK', '루트', '수소', '연료전지', '발전소', '상업', '운전']"
2025-06-25,economy,"현대건설, '업계 최초' 이주 없는 아파트 대수선 추진",14,현대건설 업계 최초 이주 없는 아파트 대수선 추진,"['현대건설', '업계', '이주', '아파트', '수선']"
2025-06-25,economy,"KB국민은행, 해외투자자의 국내 벤처투자 활성화 돕는다",12,KB국민은행 해외투자자의 국내 벤처투자 활성화 돕는다,"['국민은행', '해외', '투자자', '벤처', 'KB']"
2025-06-25,economy,"에어프레미아, 8번째 항공기 도입…하늘길 확장 가속화",12,에어프레미아 8번째 항공기 도입 하늘길 확장 가속화,"['항공기', '하늘', '확장', '가속']"
2025-06-25,economy,"최태원 ""생태계와 나무 키워내는 거목 되어야""",12,최태원 생태계와 나무 키워내는 거목 되어야,"['최태원', '생태계', '나무', '거목']"
2025-06-25,economy,"GH, 화성동탄2 마지막 근생용지 공급",11,GH 화성동탄2 마지막 근생용지 공급,"['화성', '동탄', '마지막', '용지', 'GH']"
2025-06-24,economy,"에버랜드, 국내 테마파크 최초 테이크아웃 음료 다회용 컵 사용",28,에버랜드 국내 테마파크 최초 테이크아웃 음료 다회용 컵 사용,"['에버랜드', '테마파크', '테이크아웃', '음료', '다회', '사용']"
2025-06-24,economy,"경기도, 스타트업 생태계 활성화 나섰다",23,경기도 스타트업 생태계 활성화 나섰다,"['경기도', '스타트', '생태계']"
2025-06-24,economy,전남 농수산식품 수출 3억5000만 달러…28개월 연속 늘어,23,전남 농수산식품 수출 3억5000만 달러 28개월 연속 늘어,"['전남', '농수산', '식품']"
2025-06-24,economy,"현대건설, 동유럽 이어 북유럽 대형원전 시장 진출",19,현대건설 동유럽 이어 북유럽 대형원전 시장 진출,"['현대건설', '동유럽', '북유럽', '원전']"
2025-06-24,economy,"LG유플러스, 차별화된 고객 가치 창출 위한 '위닝 R&D' 전략 강조",17,LG유플러스 차별화된 고객 가치 창출 위한 위닝 R D 전략 강조,"['LG유플러스', '차별', '고객', '창출', 'LG']"
2025-06-24,economy,"우리은행, 우리WON뱅킹 앱에서 주식거래 가능 

우리은행이 우리WON뱅킹 앱에서 주식 거래가 가능한 ‘모바일트레이딩시스템(MTS) 연계 서비스’를 정식 오픈했다고 24일 밝혔다.",16,우리은행 우리WON뱅킹 앱에서 주식거래 가능 우리은행이 우리WON뱅킹 앱에서 주식 거래가 가능한 모바일트레이딩시스템 MTS 연계 서비스 를 정식 오픈했다고 24일 밝혔다,"['우리은행', '뱅킹', '트레이딩', '연계', '정식', 'WON', 'MTS']"
2025-06-24,economy,"LG전자, 초프리미엄 세탁기와 건조기로 미국 시장 공략",15,LG전자 초프리미엄 세탁기와 건조기로 미국 시장 공략,"['LG전자', '프리미엄', '세탁기', '건조기', '미국', '공략', 'LG']"
2025-06-24,economy,"아산시, 청년 마음 돌봄 정책 가동...심리지원 프로그램 본격 운영",15,아산시 청년 마음 돌봄 정책 가동 심리지원 프로그램 본격 운영,"['아산시', '청년', '마음', '가동', '심리', '운영']"
2025-06-24,economy,"신세계라이브쇼핑, 브랜드 유통 참전…라이선스 사업 개시",14,신세계라이브쇼핑 브랜드 유통 참전 라이선스 사업 개시,"['신세계', '라이브', '쇼핑', '참전', '라이선스']"
2025-06-24,economy,"신한카드, 3억달러 규모 해외 신디케이티드론 조달 성공",14,신한카드 3억달러 규모 해외 신디케이티드론 조달 성공,"['신한카드', '해외', '케이티', '조달']"
2025-06-23,economy,"금융당국, 중동 정세 불안으로 국내 증시 변동성 커질 가능성 대비 긴급 대응 나서",26,금융당국 중동 정세 불안으로 국내 증시 변동성 커질 가능성 대비 긴급 대응 나서,"['당국', '중동', '정세']"
2025-06-23,economy,"충남 벤처, 세계시장 진출 길 연다",24,충남 벤처 세계시장 진출 길 연다,"['충남', '벤처', '세계']"
2025-06-23,economy,3분기 전기요금 동결…전기료 인하는 무산,23,3분기 전기요금 동결 전기료 인하는 무산,"['전기', '요금', '동결', '전기료', '무산']"
2025-06-23,economy,"김민석 국무총리 후보자, 출판기념회에서 수억 원대 현금 받았다고 사실상 자백",21,김민석 국무총리 후보자 출판기념회에서 수억 원대 현금 받았다고 사실상 자백,"['김민석', '국무총리', '출판', '기념회', '현금', '자백']"
2025-06-23,economy,"KB국민은행, 한국무역보험공사와 4600억원 규모 금융지원 실시",19,KB국민은행 한국무역보험공사와 4600억원 규모 금융지원 실시,"['국민은행', '한국무역보험공사', 'KB']"
2025-06-23,economy,"백종원 대표 더본코리아, 배달의민족과 할인전 진행",19,백종원 대표 더본코리아 배달의민족과 할인전 진행,"['백종원', '코리아', '배달', '민족', '할인']"
2025-06-23,economy,"대우건설, 개포우성7차 재건축사업 파격조건 제시",18,대우건설 개포우성7차 재건축사업 파격조건 제시,"['대우건설', '개포', '우성', '재건축', '파격', '조건', '제시']"
2025-06-23,economy,"현대차 고성능 브랜드 '현대 N', 10년 연속 '뉘르부르크링 24시 내구레이스' 완주 성공",18,현대차 고성능 브랜드 현대 N 10년 연속 뉘르부르크링 24시 내구레이스 완주 성공,"['현대차', '성능', '현대', '뉘르부르크링 24시', '내구', '레이스', '완주']"
2025-06-23,economy,"미국의 이란 공습에 중동 정세 불안 고조…정부, 비상대응체계 가동",17,미국의 이란 공습에 중동 정세 불안 고조 정부 비상대응체계 가동,"['미국', '이란', '공습', '중동', '정세', '고조', '비상', '체계', '가동']"
2025-06-23,economy,"NH투자증권, 공모주 간편투자 서비스 '일육공' 제휴 기념 론칭 이벤트 진행",16,NH투자증권 공모주 간편투자 서비스 일육공 제휴 기념 론칭 이벤트 진행,"['NH투자증권', '공모주', '제휴', '기념', '이벤트', 'NH']"
2025-07-04,economy,5월 경상수지 25개월째 흑자 기록…대미 수출 감소는 과제,41,5월 경상수지 25개월째 흑자 기록 대미 수출 감소는 과제,"['5월', '경상수지', '대미', '과제']"
2025-07-04,economy,"삼성자산운용, 월배당 ETF 가이드북 발간",25,삼성자산운용 월배당 ETF 가이드북 발간,"['삼성자산운용', '가이드북', '발간', 'ETF']"
2025-07-04,economy,"삼성전자, 반도체 부진에 성과급 축소…MX사업부는 75% 지급",23,삼성전자 반도체 부진에 성과급 축소 MX사업부는 75 지급,"['삼성전자', '반도체', '성과급', '사업부', 'MX']"
2025-07-04,economy,"셀트리온홀딩스, 1조원 규모 신규 재원 확보",22,셀트리온홀딩스 1조원 규모 신규 재원 확보,"['신규', '재원']"
2025-07-04,economy,"네이버 전 대표 출신 한성숙 중기부 장관 후보자, 네이버 스톡옵션 6만주 행사 처분 예정",22,네이버 전 대표 출신 한성숙 중기부 장관 후보자 네이버 스톡옵션 6만주 행사 처분 예정,"['네이버', '출신', '성숙', '중기', '스톡', '옵션', '처분']"
2025-07-04,economy,"현대차, 미국IIHS 최고등급 5년간 106개 모델",22,현대차 미국IIHS 최고등급 5년간 106개 모델,"['현대차', '미국', '등급', '5년', '모델', 'IIHS']"
2025-07-04,economy,우리나라 외환시장 거래시간 연장 후 거래량 16% 증가,21,우리나라 외환시장 거래시간 연장 후 거래량 16 증가,"['우리나라', '외환', '시간', '거래량']"
2025-07-04,economy,"서울시, 미리내집 매년 4000가구 공급 확대",21,서울시 미리내집 매년 4000가구 공급 확대,"['서울시', '미리내', '가구']"
