date,category,title,article_count,clean_title,keywords
2025-11-07,total,"정부, 종묘 앞 고층 건물 개발 규제 강력 반발",25,정부 종묘 앞 고층 건물 개발 규제 강력 반발,"['종묘', '고층 건물', '규제', '반발']"
2025-11-07,total,"삼성그룹 사업지원TF, 정식 사업지원실로 개편",24,삼성그룹 사업지원TF 정식 사업지원실로 개편,"['삼성그룹', 'TF', '정식']"
2025-11-07,total,"국민의힘, 김현지 실장 국감 불출석 강력 비판",23,국민의힘 김현지 실장 국감 불출석 강력 비판,"['김현지', '실장']"
2025-11-06,total,"이재명 대통령, 울산 발전소서 구조물 붕괴 사고 보고받고 인명 구조 지시",101,이재명 대통령 울산 발전소서 구조물 붕괴 사고 보고받고 인명 구조 지시,"['이재명', '대통령', '울산', '발전소', '구조물', '붕괴', '인명', '구조', '지시']"
2025-11-06,total,"LG전자·LG에너지솔루션, CES 2026 혁신상 수상",66,LG전자 LG에너지솔루션 CES 2026 혁신상 수상,"['LG전자', '에너지', '솔루션', 'LG', 'CES']"
2025-11-06,total,국회 운영위 국정감사 파행,63,국회 운영위 국정감사 파행,"['운영위', '국정', '파행']"
2025-11-06,total,"국내 기업들, CES 2026 혁신상 다수 수상",56,국내 기업들 CES 2026 혁신상 다수 수상,"['다수', 'CES']"
2025-11-06,total,중소기업 지원 및 금융·기술 협력 행사 개최,51,중소기업 지원 및 금융 기술 협력 행사 개최,[]
2025-11-06,total,서울시 개발 규제 완화 조례 유효,49,서울시 개발 규제 완화 조례 유효,"['서울시', '규제', '조례', '유효']"
2025-11-06,total,"네이버, '에이전트 N'으로 AI 전략 확장",39,네이버 에이전트 N 으로 AI 전략 확장,"['네이버', '에이전트', '확장', 'AI']"
2025-11-06,total,KB자산운용과 신한투자증권의 투자 세미나,39,KB자산운용과 신한투자증권의 투자 세미나,"['자산운용', '신한', '세미나', 'KB']"
2025-11-06,total,KT 무단 소액결제 사건 파문,38,KT 무단 소액결제 사건 파문,"['무단', '소액', '결제', '파문', 'KT']"
2025-11-06,total,"이재명 대통령, 김현지 실장 국회 출석 대기 지시",33,이재명 대통령 김현지 실장 국회 출석 대기 지시,"['이재명', '대통령', '김현지', '실장', '대기', '지시']"
2025-11-05,total,"한화솔루션, 3분기 매출 성장·적자 축소",43,한화솔루션 3분기 매출 성장 적자 축소,"['한화', '솔루션']"
2025-11-05,total,포스코 작업장 기체 흡입 사고 발생,42,포스코 작업장 기체 흡입 사고 발생,"['포스코', '작업장', '기체', '흡입']"
2025-11-05,total,"한화그룹 회장, 한화이글스 준우승 기념 오렌지색 휴대전화 선물",41,한화그룹 회장 한화이글스 준우승 기념 오렌지색 휴대전화 선물,"['한화그룹', '한화', '이글스', '준우승', '기념', '오렌지색', '휴대', '전화', '선물']"
2025-11-05,total,서울시 주거비 부담 완화 정책 확대,40,서울시 주거비 부담 완화 정책 확대,"['서울시', '주거비', '부담']"
2025-11-05,total,충남도 내년 예산 12조 4628억 원 편성,34,충남도 내년 예산 12조 4628억 원 편성,"['충남', '편성']"
2025-11-05,total,"LH-삼성, AI 가전 적용 모듈러 주택 공개",32,LH 삼성 AI 가전 적용 모듈러 주택 공개,"['삼성', '가전', '모듈', '주택', 'LH', 'AI']"
2025-11-05,total,"부산, 분산에너지 특화지역 지정",32,부산 분산에너지 특화지역 지정,"['부산', '분산', '에너지', '특화', '지정']"
2025-11-05,total,"정부, YTN 포함 공공자산 매각 전수조사 실시",30,정부 YTN 포함 공공자산 매각 전수조사 실시,"['포함', '공공', '자산', 'YTN']"
2025-11-05,total,RAD KOREA WEEK 2025 개막,30,RAD KOREA WEEK 2025 개막,"['RAD', 'KOREA', 'WEEK']"
2025-11-05,total,"LX인터내셔널, 구혁서 부사장 신임 대표이사 내정",27,LX인터내셔널 구혁서 부사장 신임 대표이사 내정,"['인터내셔널', '부사장', '신임', '이사', 'LX']"
2025-11-04,total,"국민의힘, 이재명 대통령 시정연설 보이콧",197,국민의힘 이재명 대통령 시정연설 보이콧,"['이재명', '대통령', '시정', '연설', '보이콧']"
2025-11-04,total,포항·광양·당진 철강 관세 공동 대응,46,포항 광양 당진 철강 관세 공동 대응,"['포항', '광양', '당진', '철강', '관세', '공동']"
2025-11-04,total,"한미안보협의회의, 핵잠 도입·전작권 전환 논의",43,한미안보협의회의 핵잠 도입 전작권 전환 논의,"['안보', '협의회', '전작']"
2025-11-04,total,강동구 재개발 조합 사무실 흉기 난동 사건 발생,42,강동구 재개발 조합 사무실 흉기 난동 사건 발생,"['강동구', '조합', '사무실', '흉기', '난동']"
2025-11-04,total,북한 외교 원로 김영남 전 상임위원장 사망,42,북한 외교 원로 김영남 전 상임위원장 사망,"['북한', '외교', '원로', '김영남', '상임', '사망']"
2025-11-04,total,미국주식 주간거래 재개,39,미국주식 주간거래 재개,['미국']
2025-11-04,total,"NH투자증권, 임원 주식매매 전면 금지",38,NH투자증권 임원 주식매매 전면 금지,"['NH투자증권', '임원', '매매', '전면', '금지', 'NH']"
2025-11-04,total,"이재명 대통령, 공기업 민영화 절차 개선 지시",37,이재명 대통령 공기업 민영화 절차 개선 지시,"['이재명', '대통령', '공기업', '민영화', '절차', '지시']"
2025-11-04,total,SK텔레콤 개인정보 유출 피해자 배상 권고,35,SK텔레콤 개인정보 유출 피해자 배상 권고,"['SK텔레콤', '개인정보', '유출', '피해자', '배상', '권고', 'SK']"
2025-11-04,total,"이재명 대통령, APEC 외교 성공 강조 및 예산안 협조 촉구",35,이재명 대통령 APEC 외교 성공 강조 및 예산안 협조 촉구,"['이재명', '대통령', '외교', '예산안', '협조', '촉구', 'APEC']"
2025-11-03,total,"대통령실, 재판중지법 '불필요한 법안' 공식화",79,대통령실 재판중지법 불필요한 법안 공식화,"['대통령', '중지', '불필요']"
2025-11-03,total,"KG모빌리티, 현대차 등 10월 판매 동향",62,KG모빌리티 현대차 등 10월 판매 동향,"['모빌리티', '현대차', '10월', '동향', 'KG']"
2025-11-03,total,"한미 2000억 달러 투자, 국내 기업 우선권 부여",38,한미 2000억 달러 투자 국내 기업 우선권 부여,"['우선권', '부여']"
2025-11-03,total,"경찰, 캄보디아 사건 등 24건 수사 중",36,경찰 캄보디아 사건 등 24건 수사 중,['캄보디아']
2025-11-03,total,"경기도, 2026년 본예산 39조9046억 원 편성",35,경기도 2026년 본예산 39조9046억 원 편성,"['경기도', '본예산', '편성']"
2025-11-03,total,"권성동 의원, 통일교 자금 수수 혐의 첫 재판서 부인",34,권성동 의원 통일교 자금 수수 혐의 첫 재판서 부인,"['권성동', '통일교', '수수', '부인']"
2025-11-03,total,SOL 조선TOP3플러스 순자산 2조 돌파,34,SOL 조선TOP3플러스 순자산 2조 돌파,"['조선', '플러스', '자산', 'SOL', 'TOP']"
2025-11-03,total,국산화 혁신 위성 5호기 성공적 발사,31,국산화 혁신 위성 5호기 성공적 발사,"['국산', '위성', '발사']"
2025-11-03,total,"올해 독감 유행, 10년 만에 최악 전망",31,올해 독감 유행 10년 만에 최악 전망,"['독감', '유행', '최악']"
2025-11-03,total,"성남시·한전KPS·현대오토에버, 혁신 및 품질 평가서 수상",30,성남시 한전KPS 현대오토에버 혁신 및 품질 평가서 수상,"['성남시', '한전KPS', '현대오토에버', '품질', 'KPS']"
2025-11-14,total,"삼양컴텍·셀트리온제약, 3분기 호실적 달성",196,삼양컴텍 셀트리온제약 3분기 호실적 달성,"['셀트리온', '제약']"
2025-11-14,total,한미 협상 '조인트 팩트시트' 발표 후 반응,141,한미 협상 조인트 팩트시트 발표 후 반응,"['조인트', '시트']"
2025-11-14,total,CJ·다날 3분기 실적 발표,69,CJ 다날 3분기 실적 발표,"['다날', 'CJ']"
2025-11-14,total,"기아 PBV 전용 공장 준공, 화성시 미래 모빌리티 허브로 도약",48,기아 PBV 전용 공장 준공 화성시 미래 모빌리티 허브로 도약,"['기아', '전용', '공장', '준공', '화성시', '미래', '모빌리티', '허브', '도약', 'PBV']"
2025-11-14,total,노만석 검찰총장 직무대행 퇴임,48,노만석 검찰총장 직무대행 퇴임,"['만석', '총장', '직무', '대행', '퇴임']"
2025-11-14,total,한미 의약품 관세 15% 이하 확정,39,한미 의약품 관세 15 이하 확정,"['의약품', '관세', '이하']"
2025-11-14,total,"한미, 3500억 달러 전략적 투자 MOU 체결",35,한미 3500억 달러 전략적 투자 MOU 체결,[]
2025-11-14,total,"BGF그룹, 글로벌 경쟁력 강화 조직 개편",32,BGF그룹 글로벌 경쟁력 강화 조직 개편,"['경쟁력', '조직', 'BGF']"
2025-11-14,total,"정부, 환율 안정을 위한 적극적 대응 예고",32,정부 환율 안정을 위한 적극적 대응 예고,"['적극', '예고']"
2025-11-14,total,효성ITX-요꼬가와전기 MOU 및 효성-메르세데스 협력 강화,28,효성ITX 요꼬가와전기 MOU 및 효성 메르세데스 협력 강화,"['효성ITX', '전기', '효성', '메르세데스', 'ITX']"
2025-11-13,total,수능 결시 학생 수색 후 무사 발견,122,수능 결시 학생 수색 후 무사 발견,"['수능', '학생', '수색', '무사', '발견']"
2025-11-13,total,HD현대·인도 정부 협력 확대,64,HD현대 인도 정부 협력 확대,"['현대', '인도', 'HD']"
2025-11-13,total,2026학년도 수능 난이도 및 주요 특징,53,2026학년도 수능 난이도 및 주요 특징,"['학년', '수능', '난이도', '특징']"
2025-11-13,total,2025 수능 수험생 대상 특별 할인 이벤트,53,2025 수능 수험생 대상 특별 할인 이벤트,"['수능', '수험', '할인', '이벤트']"
2025-11-13,total,"이재명 대통령, 6대 분야 구조개혁 추진",43,이재명 대통령 6대 분야 구조개혁 추진,"['이재명', '대통령', '구조', '개혁']"
2025-11-13,total,KB·삼성 운용사 펀드 성장세 주목,42,KB 삼성 운용사 펀드 성장세 주목,"['삼성', '운용사', '펀드', '성장세', 'KB']"
2025-11-13,total,부천 재래시장 트럭 돌진 사고,41,부천 재래시장 트럭 돌진 사고,"['부천', '재래시장', '트럭', '돌진']"
2025-11-13,total,"2026학년도 수능 수학, 지난해와 비슷하거나 다소 어려워",41,2026학년도 수능 수학 지난해와 비슷하거나 다소 어려워,"['학년', '수능', '수학']"
2025-11-13,total,"경기도, 캠프그리브스 전시 및 전세 프로젝트 성과 발표",33,경기도 캠프그리브스 전시 및 전세 프로젝트 성과 발표,"['경기도', '캠프', '리브스', '전시', '전세', '성과']"
2025-11-13,total,"울산화력발전소 붕괴사고, 7일 만에 공식 사과",31,울산화력발전소 붕괴사고 7일 만에 공식 사과,"['울산화력발전소', '붕괴', '사과']"
2025-11-12,total,"황교안 전 총리, 내란 혐의 체포 후 진술 거부",59,황교안 전 총리 내란 혐의 체포 후 진술 거부,"['황교안', '내란', '진술', '거부']"
2025-11-12,total,소상공인 경기동향지수 최고치 및 지원 확대,46,소상공인 경기동향지수 최고치 및 지원 확대,"['소상', '공인', '경기', '동향']"
2025-11-12,total,풀리오·대신송촌재단 사회공헌 활동,41,풀리오 대신송촌재단 사회공헌 활동,"['대신', '재단', '사회', '공헌', '활동']"
2025-11-12,total,"한덕수 전 총리 내란 재판, 내년 1월 선고 예정",36,한덕수 전 총리 내란 재판 내년 1월 선고 예정,"['한덕수', '내란', '1월']"
2025-11-12,total,10월 고용률 상승 속 청년층 고용 부진 지속,33,10월 고용률 상승 속 청년층 고용 부진 지속,"['10월', '고용', '청년']"
2025-11-12,total,봉화 양수발전소 예타 대상 선정,29,봉화 양수발전소 예타 대상 선정,"['봉화', '양수', '발전소']"
2025-11-12,total,"파두, AI 데이터센터 SSD 수요 증가로 매출 2.5배 성장",29,파두 AI 데이터센터 SSD 수요 증가로 매출 2 5배 성장,"['파두', '수요', 'AI', 'SSD']"
2025-11-12,total,"민주당, 대장동 항소 포기 반발 검사에 엄정 대응 강조",28,민주당 대장동 항소 포기 반발 검사에 엄정 대응 강조,"['민주당', '대장동', '반발', '검사', '엄정']"
2025-11-12,total,"포스코홀딩스, 호주·아르헨티나 리튬 자원 확보에 1조1천억 투자",28,포스코홀딩스 호주 아르헨티나 리튬 자원 확보에 1조1천억 투자,"['호주', '아르헨티나', '리튬', '자원']"
2025-11-12,total,노만석 검찰총장 직무대행 사퇴 압박 속 침묵,27,노만석 검찰총장 직무대행 사퇴 압박 속 침묵,"['만석', '총장', '직무', '대행', '압박', '침묵']"
2025-11-11,total,삼성증권 등 주요 기업 3분기 실적 발표,83,삼성증권 등 주요 기업 3분기 실적 발표,['삼성증권']
2025-11-11,total,2026학년도 수능 대비 특별 수송 및 지원 대책,79,2026학년도 수능 대비 특별 수송 및 지원 대책,"['학년', '수능', '수송']"
2025-11-11,total,"헌법존중 정부혁신 TF, 12·3 비상계엄 관련 공직자 조사",75,헌법존중 정부혁신 TF 12 3 비상계엄 관련 공직자 조사,"['헌법', '존중', '비상계엄', '공직자', 'TF']"
2025-11-11,total,컬리·컴투스·한투證 3분기 실적,66,컬리 컴투스 한투 3분기 실적,"['컬리', '컴투스', '한투']"
2025-11-11,total,대장동 사건 항소심 재판부 배당 및 논란,55,대장동 사건 항소심 재판부 배당 및 논란,"['대장동', '항소심', '재판부']"
2025-11-11,total,한국 경제성장률 및 수출 전망 상향 조정,43,한국 경제성장률 및 수출 전망 상향 조정,"['경제성장', '상향']"
2025-11-11,total,"국민의힘, 검찰 항소 포기 규탄",34,국민의힘 검찰 항소 포기 규탄,[]
2025-11-11,total,"정부, 구글 고정밀 지도 반출 심의 보류 및 서류 보완 요구",28,정부 구글 고정밀 지도 반출 심의 보류 및 서류 보완 요구,"['구글', '정밀', '지도', '반출', '보류', '서류', '보완', '요구']"
2025-11-11,total,"배우 오영수, 강제추행 혐의 항소심 무죄 판결",27,배우 오영수 강제추행 혐의 항소심 무죄 판결,"['배우', '오영수', '강제', '추행', '항소심', '무죄']"
2025-11-11,total,김해시·광주시·전북도 2026년 예산안 확정,25,김해시 광주시 전북도 2026년 예산안 확정,"['김해시', '광주시', '전북도', '예산안']"
2025-11-10,total,각 기업 3분기 실적 호조,146,각 기업 3분기 실적 호조,['호조']
2025-11-10,total,대장동 항소 포기 논란 확산,141,대장동 항소 포기 논란 확산,['대장동']
2025-11-10,total,"미중 무역 휴전 합의, 한화오션 제재 유예",57,미중 무역 휴전 합의 한화오션 제재 유예,"['미중', '휴전', '한화', '오션', '제재']"
2025-11-10,total,3분기 주요 기업 실적 동향,45,3분기 주요 기업 실적 동향,['동향']
2025-11-10,total,"이재명 대통령, 당정 원팀 강조",40,이재명 대통령 당정 원팀 강조,"['이재명', '대통령', '당정', '팀 강']"
2025-11-10,total,서해상 중국 어선 전복 사고 및 불법 조업 증가,33,서해상 중국 어선 전복 사고 및 불법 조업 증가,"['서해', '중국', '어선', '전복', '불법', '조업']"
2025-11-10,total,"현대건설-현대위아, 로봇 주차 솔루션 개발 협약",32,현대건설 현대위아 로봇 주차 솔루션 개발 협약,"['현대건설', '현대위아', '로봇', '주차', '솔루션']"
2025-11-10,total,임성근 전 사단장 구속 기소,30,임성근 전 사단장 구속 기소,"['임성근', '사단장']"
2025-11-10,total,"국내 기업, CES 2026 혁신상 다수 수상",30,국내 기업 CES 2026 혁신상 다수 수상,"['다수', 'CES']"
2025-11-10,total,2026 수능일 경찰력 2만 명 투입,30,2026 수능일 경찰력 2만 명 투입,"['수능', '경찰력', '투입']"
2025-11-21,total,고창 운곡습지·강원랜드·한전KPS 등 최우수 ESG 평가,85,고창 운곡습지 강원랜드 한전KPS 등 최우수 ESG 평가,"['고창', '습지', '강원랜드', '한전KPS', '최우', 'KPS', 'ESG']"
2025-11-21,total,"포스코, 포항제철소 사고 후 안전 대책 강화",57,포스코 포항제철소 사고 후 안전 대책 강화,"['포스코', '포항', '제철소', '안전']"
2025-11-21,total,"삼성전자, 전영현·노태문 투톱 체제 복원",49,삼성전자 전영현 노태문 투톱 체제 복원,"['삼성전자', '전영', '태무', '체제', '복원']"
2025-11-21,total,김영삼 전 대통령 서거 10주기 추모식,44,김영삼 전 대통령 서거 10주기 추모식,"['김영삼', '대통령', '서거', '주기', '추모식']"
2025-11-21,total,"박철우 서울중앙지검장, 성찰과 조직 안정 강조",42,박철우 서울중앙지검장 성찰과 조직 안정 강조,"['박철우', '중앙', '지검', '성찰', '조직']"
2025-11-21,total,"윤석열 전 대통령, 채해병 사건 외압 혐의로 기소",30,윤석열 전 대통령 채해병 사건 외압 혐의로 기소,"['윤석열', '대통령', '외압']"
2025-11-21,total,"농심, 조용철 부사장 신임 대표이사 내정",28,농심 조용철 부사장 신임 대표이사 내정,"['농심', '조용철', '부사장', '신임', '이사']"
2025-11-21,total,휴대전화 요구 거부로 자택 방화한 10대 여중생 입건,27,휴대전화 요구 거부로 자택 방화한 10대 여중생 입건,"['휴대', '전화', '요구', '거부', '자택', '방화', '10대', '중생']"
2025-11-21,total,"삼성E&A-대한항공, 미국 SAF 시장 진출 협력",25,삼성E A 대한항공 미국 SAF 시장 진출 협력,"['삼성', '대한항공', '미국', 'SAF']"
2025-11-21,total,20년 만의 신정동 연쇄살인 진범 특정,24,20년 만의 신정동 연쇄살인 진범 특정,"['신정동', '연쇄살인', '특정']"
2025-11-20,total,패스트트랙 충돌 사건 1심 선고 결과,123,패스트트랙 충돌 사건 1심 선고 결과,"['패스트', '트랙', '충돌 사건']"
2025-11-20,total,"대형 여객선 좌초 사고, 운항 과실 및 관제 소홀 드러나",91,대형 여객선 좌초 사고 운항 과실 및 관제 소홀 드러나,"['여객선', '좌초', '운항', '과실', '관제', '소홀']"
2025-11-20,total,"NH·한화·컴투스·현대로템, ESG 평가서 우수 성과",55,NH 한화 컴투스 현대로템 ESG 평가서 우수 성과,"['한화', '컴투스', '현대로템', '우수', '성과', 'NH', 'ESG']"
2025-11-20,total,"삼성전자, C랩 스타트업 데모데이 개최",48,삼성전자 C랩 스타트업 데모데이 개최,"['삼성전자', '스타트', '데모', '데이']"
2025-11-20,total,"S-OIL, 현대차 등 기업 사회공헌 활동 인정",42,S OIL 현대차 등 기업 사회공헌 활동 인정,"['현대차', '사회', '공헌', '활동', '인정', 'OIL']"
2025-11-20,total,포스코 포항제철소 가스 누출 사고 발생,41,포스코 포항제철소 가스 누출 사고 발생,"['포스코', '포항', '제철소', '가스', '누출']"
2025-11-20,total,"법무부 장관, 한동훈 전 장관의 론스타 취소 신청 평가",37,법무부 장관 한동훈 전 장관의 론스타 취소 신청 평가,"['법무부', '한동훈', '론스타', '취소']"
2025-11-20,total,"LG에너지솔루션, 2년 연속 XBRL 재무공시 우수법인 선정",35,LG에너지솔루션 2년 연속 XBRL 재무공시 우수법인 선정,"['에너지', '솔루션', '재무', '우수', '법인', 'LG', 'XBRL']"
2025-11-20,total,"김우빈·신민아, 공개연애 10년 만에 결혼",34,김우빈 신민아 공개연애 10년 만에 결혼,"['김우빈', '신민아', '연애', '결혼']"
2025-11-20,total,2026년 지자체별 예산안 주요 내용,31,2026년 지자체별 예산안 주요 내용,"['지자체', '예산안']"
2025-11-19,total,제주항공·신한금융 등 ESG 평가 상위 등급 획득,168,제주항공 신한금융 등 ESG 평가 상위 등급 획득,"['제주항공', '신한', '상위', '등급', '획득', 'ESG']"
2025-11-19,total,"전국 지자체, 고액·상습 체납자 명단 공개",62,전국 지자체 고액 상습 체납자 명단 공개,"['지자체', '고액', '상습', '체납', '명단']"
2025-11-19,total,김용현 전 장관 변호인 구속 및 윤석열 전 대통령 증인 출석,50,김용현 전 장관 변호인 구속 및 윤석열 전 대통령 증인 출석,"['김용현', '변호인', '윤석열', '대통령', '증인']"
2025-11-19,total,"KT 조사방해 의혹‥경찰, 판교·방배 사옥 압수수색",47,KT 조사방해 의혹 경찰 판교 방배 사옥 압수수색,"['방해', '판교', '사옥', 'KT']"
2025-11-19,total,"DL이앤씨, 필리핀 대통령과 에너지·인프라 협력 논의",44,DL이앤씨 필리핀 대통령과 에너지 인프라 협력 논의,"['필리핀', '대통령', '에너지', '인프라', 'DL']"
2025-11-19,total,2025 KB굿잡 대전일자리 페스티벌 성료,37,2025 KB굿잡 대전일자리 페스티벌 성료,"['대전', '일자리', '페스티벌', 'KB']"
2025-11-19,total,"삼성전자, 세계 최대 크루즈선에 TV·사이니지 6천대 공급",36,삼성전자 세계 최대 크루즈선에 TV 사이니지 6천대 공급,"['삼성전자', '세계', '크루즈', '니지', 'TV']"
2025-11-19,total,부산·울산·경남·고액 체납자 명단 공개,34,부산 울산 경남 고액 체납자 명단 공개,"['부산', '울산', '경남', '고액', '체납', '명단']"
2025-11-19,total,"중·일 갈등 심화, 일본산 수산물 수입 중단",32,중 일 갈등 심화 일본산 수산물 수입 중단,"['심화', '일본산', '수산물']"
2025-11-19,total,한·UAE 공동선언문 채택...원전·방산 협력 확대,32,한 UAE 공동선언문 채택 원전 방산 협력 확대,"['공동', '선언문', '원전', '방산', 'UAE']"
2025-11-18,total,"전광훈 목사, 서부지법 난동 사태 조사 출석",40,전광훈 목사 서부지법 난동 사태 조사 출석,"['전광훈', '목사', '서부', '지법', '난동']"
2025-11-18,total,정부혁신TF 논란과 정치권 반응,31,정부혁신TF 논란과 정치권 반응,"['TF', '정치']"
2025-11-18,total,"국민의힘, 법무부 장관·차관 고발",31,국민의힘 법무부 장관 차관 고발,['법무부']
2025-11-18,total,"카카오뱅크, 구몬학습, 통신3사 신서비스 출시",29,카카오뱅크 구몬학습 통신3사 신서비스 출시,"['카카오', '뱅크', '구몬학습', '통신']"
2025-11-18,total,고령2터널 화물차 연쇄 추돌 사고 발생,27,고령2터널 화물차 연쇄 추돌 사고 발생,"['고령', '터널', '화물차', '연쇄', '추돌']"
2025-11-18,total,전남 학교 무상급식 식품비 분담 ‘분쟁 해소’,27,전남 학교 무상급식 식품비 분담 분쟁 해소,"['전남', '학교', '무상급식', '식품', '분담', '해소']"
2025-11-18,total,항만 안전사고 예방 강화대책 발표 및 한국투자증권 투자 보호 기능 도입,27,항만 안전사고 예방 강화대책 발표 및 한국투자증권 투자 보호 기능 도입,"['안전사고', '보호', '기능']"
2025-11-18,total,"클럽마약 적발량 급증, 외국인 조직 단속",25,클럽마약 적발량 급증 외국인 조직 단속,"['클럽', '마약', '적발', '급증', '외국인', '조직', '단속']"
2025-11-18,total,"KAI, 두바이 에어쇼서 KF-21 선보이며 중동 시장 공략",25,KAI 두바이 에어쇼서 KF 21 선보이며 중동 시장 공략,"['두바이 에어쇼', '중동', '공략', 'KAI', 'KF']"
2025-11-18,total,"대원제약, ESG 평가 최고등급 획득 및 베스트 100대 기업 선정",25,대원제약 ESG 평가 최고등급 획득 및 베스트 100대 기업 선정,"['대원', '제약', '등급', '획득', '베스트', 'ESG']"
2025-11-17,total,"현대차·기아, 공급망 탄소 감축 협약 체결",50,현대차 기아 공급망 탄소 감축 협약 체결,"['현대차', '기아', '탄소', '감축']"
2025-11-17,total,배우 나나 자택 침입 강도 “연예인 집인 줄 몰랐다”,40,배우 나나 자택 침입 강도 연예인 집인 줄 몰랐다,"['배우', '나나', '자택', '침입', '강도', '연예인']"
2025-11-17,total,이재명 대통령 지지도 3주 만에 하락,34,이재명 대통령 지지도 3주 만에 하락,"['이재명', '대통령', '지지도']"
2025-11-17,total,"이재명 대통령, 안권섭 변호사 특검 임명",34,이재명 대통령 안권섭 변호사 특검 임명,"['이재명', '대통령', '변호사', '특검']"
2025-11-17,total,"내란 특검, 노상원 전 사령관에 실형 구형",34,내란 특검 노상원 전 사령관에 실형 구형,"['내란', '특검', '상원', '사령관']"
2025-11-17,total,S-OIL-삼성SDS 통합 ITO 계약 체결,33,S OIL 삼성SDS 통합 ITO 계약 체결,"['삼성SDS', '통합', 'OIL', 'SDS', 'ITO']"
2025-11-17,total,"기아, 평택에 미래형 모빌리티 복합센터 개소",31,기아 평택에 미래형 모빌리티 복합센터 개소,"['기아', '평택', '미래', '모빌리티', '복합', '개소']"
2025-11-17,total,"수원시, AI·반도체 중심 경제자유구역 구축 추진",31,수원시 AI 반도체 중심 경제자유구역 구축 추진,"['수원시', '반도체', '중심', '경제자유구역', 'AI']"
